Rank,Release Group,$Worldwide,$Domestic,Domestic %,$Foreign,Foreign %,Year,Genres,Rating,Vote_Count,Original_Language,Production_Countries,Budget,TMDB Revenue,Directors,Production Companies,Id,Name
86,Collateral Beauty,88616021.0,31016021.0,35.0,57600000.0,65.0,2016,"Drama, Romance",7.223/10,5366.0,en,United States of America,36000000.0,88528280.0,David Frankel,"Village Roadshow Pictures, Likely Story, Anonymous Content, New Line Cinema, PalmStar Media, Overbrook Entertainment",345920,Collateral Beauty
87,Line Walker,88228755.0,0.0,0.0,88228755.0,100.0,2016,"Action, Crime, Drama",6.5/10,66.0,cn,"China, Hong Kong",0.0,88658655.0,Jazz Boon,"Shaw Brothers, TVB, PJ One Cool Film Company Limited, One Cool Pictures, Stellar Mega Films, J.Q. Pictures, Media Asia Films",411268,Line Walker
88,Sultan,87280000.0,6200000.0,7.1,81080000.0,92.9,2016,"Drama, Action, Romance",6.9/10,220.0,hi,India,0.0,0.0,Kartal Tibet,Arzu Film,452606,Sultan
89,War Dogs,86434523.0,43034523.0,49.8,43400000.0,50.2,2016,"Comedy, Crime, Drama",6.9/10,4915.0,en,United States of America,50000000.0,86234523.0,Todd Phillips,"The Mark Gordon Company, Joint Effort, RatPac Entertainment",308266,War Dogs
90,Big Fish & Begonia,85409373.0,0.0,0.0,85409373.0,100.0,2016,"Animation, Adventure, Fantasy",7.4/10,438.0,zh,"China, South Korea",4531653.0,84552250.0,"Liang Xuan, Zhang Chun","Studio Mir, Beijing Enlight Pictures, Horgos Coloroom Pictures",271706,Big Fish & Begonia
91,Nerve,85251425.0,38583626.0,45.3,46667799.0,54.7,2016,"Mystery, Adventure, Crime",7.02/10,6773.0,en,"Hong Kong, United States of America",19000000.0,85241496.0,"Henry Joost, Ariel Schulman","Lionsgate, Allison Shearmur Productions, Keep Your Head Productions, TIK Films",328387,Nerve
92,Leap!,84197417.0,2844490.0,3.4,81352927.0,96.6,2016,Drama,5.6/10,5.0,zh,China,0.0,0.0,Michael Rowe,,63555,Leap Year
93,Ouija: Origin of Evil,81705746.0,35144505.0,43.0,46561241.0,57.0,2016,Horror,6.1/10,2460.0,en,United States of America,9000000.0,81700000.0,Mike Flanagan,"Platinum Dunes, Universal Pictures, Allspark Pictures, Blumhouse Productions, Hasbro",335796,Ouija: Origin of Evil
94,Underworld: Blood Wars,81093313.0,30353973.0,37.4,50739340.0,62.6,2016,"Fantasy, Action, Thriller",5.881/10,3659.0,en,United States of America,35000000.0,81093313.0,Anna Foerster,"Lakeshore Entertainment, Screen Gems, Sketch Films",346672,Underworld: Blood Wars
95,Manchester by the Sea,78988148.0,47695371.0,60.4,31292777.0,39.6,2016,Drama,7.5/10,5834.0,en,United States of America,9000000.0,79000000.0,Kenneth Lonergan,"Pearl Street Films, K Period Media, B Story, The Affleck/Middleton Project, The Media Farm, Big Indie Pictures",334541,Manchester by the Sea
96,The Boss,78844582.0,63285885.0,80.3,15558697.0,19.7,2016,Comedy,5.83/10,1320.0,en,United States of America,29000000.0,78600000.0,Ben Falcone,"Universal Pictures, On the Day, Gary Sanchez Productions",323676,The Boss
97,Shin Godzilla,77947607.0,1918403.0,2.5,76029204.0,97.5,2016,"Action, Science Fiction, Horror",7.2/10,1308.0,ja,Japan,15000000.0,78053145.0,"Shinji Higuchi, Hideaki Anno","Toho Pictures, Cine Bazar, TOHO, Toho Eizo Bijutsu",315011,Shin Godzilla
98,Mike and Dave Need Wedding Dates,77068246.0,46009673.0,59.7,31058573.0,40.3,2016,Comedy,6.06/10,2468.0,en,United States of America,33000000.0,77100000.0,Jake Szymanski,"Chernin Entertainment, TSG Entertainment, 20th Century Fox",316023,Mike and Dave Need Wedding Dates
99,Kubo and the Two Strings,76249438.0,48023088.0,63.0,28226350.0,37.0,2016,"Animation, Adventure, Family",7.635/10,3566.0,en,United States of America,60000000.0,76249438.0,Travis Knight,Laika,313297,Kubo and the Two Strings
100,Quo vado?,75878701.0,0.0,0.0,75878701.0,100.0,2016,Comedy,6.829/10,2112.0,it,Italy,11089000.0,75173000.0,Gennaro Nunziante,"Taodue Film, Mediaset Premium",374416,Where Am I Going?
101,Boo! A Madea Halloween,74827344.0,73206343.0,97.8,1621001.0,2.2,2016,Comedy,5.7/10,411.0,en,United States of America,20000000.0,74827344.0,Tyler Perry,"Lionsgate, Tyler Perry Studios",380124,Boo! A Madea Halloween
102,Miracles from Heaven,73983003.0,61705123.0,83.4,12277880.0,16.6,2016,"Family, Drama",7.4/10,1187.0,en,United States of America,16000000.0,74000000.0,Patricia Riggen,"Columbia Pictures, Affirm Films, Roth Films, Franklin Entertainment, Sony Pictures",339984,Miracles from Heaven
103,The Nice Guys,71261763.0,36261763.0,50.9,35000000.0,49.1,2016,"Comedy, Crime, Action",7.121/10,7915.0,en,United States of America,50000000.0,71261763.0,Shane Black,"Silver Pictures, Waypoint Entertainment",290250,The Nice Guys
104,I Am Not Madame Bovary,70826207.0,436798.0,0.6,70389409.0,99.4,2016,"Comedy, Drama",6.88/10,83.0,zh,China,0.0,0.0,Feng Xiaogang,"Huayi Brothers Pictures, Beijing Culture",400114,I Am Not Madame Bovary
105,See You Tomorrow,70065569.0,0.0,0.0,70065569.0,100.0,2016,"Comedy, Drama, Romance",4.3/10,16.0,cn,"China, Hong Kong",0.0,0.0,Andrea Zaccariello,Moviemax,169683,See You Tomorrow
106,One Piece Film: Gold,66207073.0,423593.0,0.6,65783480.0,99.4,2016,"Action, Animation, Adventure, Comedy",7.202/10,485.0,ja,Japan,0.0,66207073.0,Hiroaki Miyamoto,"Fuji Television Network, Funimation Global Group, Toei Animation, Toei Company, Shueisha, Bandai, Bandai Namco Entertainment",374205,One Piece Film: GOLD
107,Moonlight,65172611.0,27854932.0,42.7,37317679.0,57.3,2016,Drama,7.379/10,7037.0,en,United States of America,4000000.0,65046687.0,Barry Jenkins,"A24, Plan B Entertainment, PASTEL",376867,Moonlight
108,Monster Trucks,64493915.0,33370166.0,51.7,31123749.0,48.3,2016,"Action, Comedy, Science Fiction",6.103/10,853.0,en,United States of America,125000000.0,64493915.0,Chris Wedge,"Nickelodeon Movies, Paramount Pictures, Disruption Entertainment, Paramount Animation",262841,Monster Trucks
109,Fences,64414761.0,57682904.0,89.5,6731857.0,10.5,2016,Drama,6.862/10,2604.0,en,"Canada, United States of America",24000000.0,64400000.0,Denzel Washington,"Paramount Pictures, Scott Rudin Productions, MACRO, Bron Studios, Escape Artists",393457,Fences
110,"Hail, Caesar!",63647656.0,30498085.0,47.9,33149571.0,52.1,2016,"Comedy, Crime, Mystery",5.92/10,3750.0,en,"United Kingdom, United States of America",22000000.0,63647656.0,"Joel Coen, Ethan Coen","Universal Pictures, Mike Zoss Productions, Working Title Films",270487,"Hail, Caesar!"
111,Chongqing Hot Pot,58106427.0,779818.0,1.3,57326609.0,98.7,2016,Drama,6.3/10,57.0,zh,China,0.0,0.0,Yang Qing,"New Classics Media, Wanda Pictures, CKF Pictures",388403,Chongqing Hot Pot
112,L.O.R.D: Legend of Ravaging Dynasties,58089494.0,350456.0,0.6,57739038.0,99.4,2016,"Animation, Fantasy, Drama, Science Fiction",7.0/10,132.0,zh,China,0.0,0.0,Guo Jingming,,630044,L.O.R.D: Legend of Ravaging Dynasties 2
113,Nine Lives,57814445.0,19700032.0,34.1,38114413.0,65.9,2016,"Fantasy, Comedy, Family",5.8/10,1066.0,en,"China, France",0.0,0.0,Rodrigo García,"Mockingbird Pictures, Z Films",16022,Nine Lives
114,Zoolander 2,56722693.0,28848693.0,50.9,27874000.0,49.1,2016,"Comedy, Adventure, Action",4.923/10,2226.0,en,United States of America,50000000.0,56722693.0,Ben Stiller,"Paramount Pictures, Red Hour, Scott Rudin Productions",329833,Zoolander 2
115,Barbershop: The Next Cut,55630051.0,54030051.0,97.1,1600000.0,2.9,2016,"Comedy, Drama",6.31/10,458.0,en,United States of America,20000000.0,55030051.0,Malcolm D. Lee,"New Line Cinema, Cube Vision, Metro-Goldwyn-Mayer, Warner Bros. Pictures",326423,Barbershop: The Next Cut
116,The Age of Shadows,54491162.0,541719.0,1.0,53949443.0,99.0,2016,"Action, Thriller",7.2/10,327.0,ko,South Korea,9620000.0,53165427.0,Kim Jee-woon,"Harbin, Warner Bros. Korea, Dark Circle Pictures",363579,The Age of Shadows
117,A Chinese Odyssey: Part Three,53306108.0,0.0,0.0,53306108.0,100.0,2016,"Adventure, Comedy, Family, Fantasy",6.2/10,15.0,zh,China,0.0,0.0,Jeffrey Lau Chun-wai,Chunqiu Time Co.,389201,A Chinese Odyssey Part Three
118,Tunnel,52444295.0,568876.0,1.1,51875419.0,98.9,2016,"Crime, Thriller",7.049/10,398.0,es,"Spain, Argentina",0.0,0.0,Daniel Baldwin,"Edgar Entertainment, Caledonia Pictures, City Heat Productions",160808,Tunnel
119,Patriots Day,52185751.0,31886361.0,61.1,20299390.0,38.9,2016,"Action, Crime, Drama, History, Thriller",7.052/10,2604.0,en,"Hong Kong, United States of America",45000000.0,50548152.0,Peter Berg,"TIK Films, CBS Films, Closest to the Hole Productions, Bluegrass Films, Hutch Parker Entertainment, Leverage Entertainment, Lionsgate",388399,Patriots Day
120,My Beloved Bodyguard,52165873.0,0.0,0.0,52165873.0,100.0,2016,"Action, Crime",5.8/10,74.0,zh,"China, Hong Kong, Malaysia",0.0,0.0,Sammo Hung Kam-Bo,"Edko Films, Focus Films Limited, Tencent Penguin Pictures, Irresistible Alpha Limited, BDI Films Inc., Good Friends Entertainment, Lava Bear Films",315669,The Bodyguard
121,The Finest Hours,52099090.0,27569558.0,52.9,24529532.0,47.1,2016,"Action, Drama, History, Thriller",6.6/10,1598.0,en,United States of America,80000000.0,52099090.0,Craig Gillespie,"Red Hawk Entertainment, Walt Disney Pictures, Whitaker Entertainment, Bergsten Music",300673,The Finest Hours
122,Master,51636415.0,597251.0,1.2,51039164.0,98.8,2016,"Action, Comedy",7.395/10,947.0,cn,Hong Kong,0.0,0.0,Mariama Diallo,"Amazon Studios, Animal Kingdom, Big Indie Pictures",680829,Master
123,Doraemon the Movie: Nobita and the Birth of Japan,50939840.0,0.0,0.0,50939840.0,100.0,2016,"Animation, Adventure, Fantasy, Science Fiction, Family",6.754/10,59.0,ja,Japan,0.0,58400000.0,Shinnosuke Yakuwa,"TOHO, TV Asahi, Fujiko Productions, Marbean Animation, Shin-Ei Animation, Next Entertainment World, Zoom (KR), Daewon Media",384345,Doraemon: Nobita and the Birth of Japan
124,The Wailing,49851770.0,786633.0,1.6,49065137.0,98.4,2016,"Horror, Mystery",7.354/10,1731.0,ko,"South Korea, United States of America",0.0,0.0,Pedro Martín Calero,"Tandem Films, Setembro Cine, Caballo Films, Tarea Fina, Noodles Production, El Llanto",1299372,The Wailing
125,Two Is a Family,49619118.0,0.0,0.0,49619118.0,100.0,2016,"Drama, Comedy",7.744/10,2965.0,fr,"France, United Kingdom",0.0,1447740.0,Hugo Gélin,"Mars Films, Poisson Rouge Pictures, TF1 Films Production, Korokoro, Vendôme Production",382591,Two Is a Family
126,Never Gone,48980792.0,96421.0,0.2,48884371.0,99.8,2016,"Comedy, Drama, Romance",6.4/10,50.0,zh,China,0.0,0.0,Zhou Tuo Ru,,405755,So Young 2: Never Gone
127,Luck-Key,48913975.0,466505.0,1.0,48447470.0,99.0,2016,"Action, Comedy, Crime",7.1/10,129.0,ko,South Korea,0.0,0.0,Lee Kae-byeok,"Yong Film, Showbox",421928,Luck-Key
128,Florence Foster Jenkins,48902953.0,27383770.0,56.0,21519183.0,44.0,2016,"Comedy, Drama",6.666/10,1449.0,en,"United Kingdom, United States of America",29000000.0,48902953.0,Stephen Frears,"BBC Film, Qwerty Films, Pathé",315664,Florence Foster Jenkins
129,Mother's Day,48782670.0,32492859.0,66.6,16289811.0,33.4,2016,"Comedy, Drama, Romance",6.0/10,1262.0,en,United States of America,0.0,0.0,Mateusz Rakowicz,"Akson Studio, Chimney Poland, Łódzkie Centrum Filmowe",1107872,Mother's Day
130,"Yo-kai Watch Movie: It's the Secret of Birth, Meow! 2016 Re-release",47642462.0,0.0,0.0,47642462.0,100.0,2016,,,,,,,,,,N/A,N/A
131,A Monster Calls,47309313.0,3740823.0,7.9,43568490.0,92.1,2016,"Drama, Fantasy, Adventure, Family, Animation, Horror",7.3/10,3305.0,en,"Spain, United States of America",43000000.0,47300000.0,J.A. Bayona,"River Road Entertainment, Participant, Apaches Films, La Trini, A Monster Calls AIE, Telecinco Cinema, Summit Entertainment, Focus Features",258230,A Monster Calls
132,Risen,46432579.0,36880033.0,79.4,9552546.0,20.6,2016,"Action, Adventure, Drama, Fantasy",6.184/10,828.0,en,United States of America,0.0,0.0,Eddie Arya,"Aryavision Pictures, Vertical",850099,Risen
133,Eddie the Eagle,46152800.0,15789389.0,34.2,30363411.0,65.8,2016,"Comedy, Drama, History, Adventure",7.168/10,2109.0,en,"Germany, United Kingdom, United States of America",23000000.0,46152411.0,Dexter Fletcher,"Studio Babelsberg, Marv, Saville Productions",319888,Eddie the Eagle
134,Blair Witch,45173154.0,20777061.0,46.0,24396093.0,54.0,2016,"Thriller, Horror",5.223/10,1903.0,en,"Canada, United States of America",5000000.0,45172994.0,Adam Wingard,"Vertigo Entertainment, Lionsgate, Room 101, Snoot Entertainment",351211,Blair Witch
135,Boonie Bears: The Big Top Secret,45150390.0,0.0,0.0,45150390.0,100.0,2016,"Animation, Adventure, Comedy",7.2/10,17.0,zh,,0.0,45150390.0,"Ding Liang, Yongchang Lin",,401791,Boonie Bears: The Big Top Secret
136,Café Society,43763247.0,11103205.0,25.4,32660042.0,74.6,2016,"Comedy, Drama, Romance",6.457/10,2680.0,en,United States of America,30000000.0,43763247.0,Woody Allen,"Perdido Productions, Gravier Productions",339397,Café Society
137,League of Gods,43498766.0,181633.0,0.4,43317133.0,99.6,2016,"Action, Fantasy",5.6/10,152.0,zh,"China, Hong Kong",38000000.0,43300000.0,Koan Hui On,"China Star Entertainment, Huayi Brothers Pictures",406429,League of Gods
138,Almost Christmas,42580920.0,42158780.0,99.0,422140.0,1.0,2016,"Comedy, Drama",5.9/10,362.0,en,United States of America,0.0,0.0,David Lowery,"Esperanto Filmoj, Titmouse, Maere Studios, Disney Branded Television",1355755,An Almost Christmas Story
139,The Witch,40423945.0,25138705.0,62.2,15285240.0,37.8,2016,"Horror, Drama, Mystery",6.973/10,6965.0,en,"Brazil, Canada, United Kingdom, United States of America",4000000.0,40423945.0,Robert Eggers,"Very Special Projects, Parts & Labor, RT Features, Rooks Nest Entertainment, Maiden Voyage Pictures, Pulse Films, Scythia Films, Code Red Productions, Mott Street Pictures",310131,The Witch
140,The Wild Life,40075446.0,8005586.0,20.0,32069860.0,80.0,2016,"Animation, Adventure, Comedy, Family",5.798/10,332.0,de,"Belgium, France, United States of America",0.0,9500000.0,Art Linson,Universal Pictures,38980,The Wild Life
141,Love O2O,39969537.0,0.0,0.0,39969537.0,100.0,2016,"Drama, Comedy, Romance",6.6/10,52.0,zh,China,0.0,39969537.0,Tianyu Zhao,,412190,Love O2O
142,The Forest,39712000.0,26594261.0,67.0,13117739.0,33.0,2016,"Horror, Thriller, Mystery",5.232/10,1735.0,en,United States of America,10000000.0,37608299.0,Jason Zada,"Lava Bear Films, AI Film, Phantom Four",329440,The Forest
143,Absolutely Fabulous: The Movie,39219109.0,4772155.0,12.2,34446954.0,87.8,2016,Comedy,5.3/10,241.0,en,United Kingdom,0.0,37915971.0,Mandie Fletcher,"British Film Company, Fox Searchlight Pictures",372411,Absolutely Fabulous: The Movie
144,My Mom Is a Character 2,39195565.0,0.0,0.0,39195565.0,100.0,2016,Comedy,7.7/10,497.0,pt,Brazil,2000000.0,39195565.0,César Rodrigues,"Migdal Filmes, Globo Filmes, Paris Filmes, Downtown Filmes, Universal Pictures International, Paramount Pictures Brasil, DiamondBack",227932,My Mom Is a Character 2
145,Masterpiece Mystery: Sherlock: The Abominable Bride,39139204.0,0.0,0.0,39139204.0,100.0,2016,,,,,,,,,,N/A,N/A
146,"Crouching Tiger, Hidden Dragon: Sword of Destiny",38659039.0,0.0,0.0,38659039.0,100.0,2016,"Action, Adventure, Drama",6.102/10,643.0,en,China,20000000.0,38659039.0,Yuen Woo-Ping,"The Weinstein Company, Yucaipa Films, Pegasus Taihe Entertainment",263341,"Crouching Tiger, Hidden Dragon: Sword of Destiny"
147,Hell or High Water,37879877.0,27007844.0,71.3,10872033.0,28.7,2016,"Western, Crime, Drama",7.3/10,4444.0,en,United States of America,12000000.0,37600000.0,David Mackenzie,"Sidney Kimmel Entertainment, Film 44, OddLot Entertainment, Estrella Media, Lionsgate, CBS Films, Sierra/Affinity",338766,Hell or High Water
148,Mission Milano,37749848.0,0.0,0.0,37749848.0,100.0,2016,"Action, Comedy",6.1/10,14.0,cn,"Hong Kong, China",0.0,0.0,Wong Jing,"Mega-Vision Pictures (MVP), Gravity Pictures, Aim Media Co",419544,Mission Milano
149,The Handmaiden,37692886.0,2006788.0,5.3,35686098.0,94.7,2016,"Thriller, Drama, Romance",8.214/10,3767.0,ko,South Korea,8575000.0,38600000.0,Park Chan-wook,"Moho Film, Yong Film, CJ Entertainment",290098,The Handmaiden
150,Snowden,37357216.0,21587519.0,57.8,15769697.0,42.2,2016,"Drama, History, Crime, Thriller",7.107/10,4321.0,en,"France, Germany, United States of America",40000000.0,37357216.0,Oliver Stone,"KrautPack Entertainment, Vendian Entertainment, Endgame Entertainment, Wild Bunch, Open Road Films, TG Media",302401,Snowden
151,Nobunaga Concerto: The Movie,36187594.0,0.0,0.0,36187594.0,100.0,2016,"Action, Comedy, Science Fiction",6.6/10,21.0,ja,Japan,0.0,0.0,Hiroaki Matsuyama,Fuji Television Network,361358,Nobunaga Concerto: The Movie
152,Eye in the Sky,35259653.0,18704595.0,53.0,16555058.0,47.0,2016,"Drama, Thriller, War",7.019/10,1568.0,en,United Kingdom,13000000.0,18704595.0,Gavin Hood,"Raindog Films, Entertainment One Features",333352,Eye in the Sky
153,The Tuche Family: The American Dream,35210425.0,0.0,0.0,35210425.0,100.0,2016,Comedy,5.6/10,948.0,fr,France,0.0,0.0,Olivier Baroux,"Pathé Distribution, Pathé Productions, TF1 Films Production",369776,The Tuche Family: The American Dream
154,Os Dez Mandamentos - O Filme,31998251.0,0.0,0.0,31998251.0,100.0,2016,Drama,7.2/10,305.0,pt,"Brazil, Morocco",39307171.0,37070177.0,Alexandre Avancini,"Downtown Filmes, Record, Record Filmes, Paris Filmes",372519,The Ten Commandments: The Movie
155,Bounty Hunters,31918573.0,0.0,0.0,31918573.0,100.0,2016,"Action, Adventure, Comedy, Drama",7.1/10,53.0,zh,"Hong Kong, China, South Korea",0.0,0.0,Shin Terra,Pegasus Motion Pictures,388764,Bounty Hunters
156,Ae Dil Hai Mushkil,31668920.0,4264983.0,13.5,27403937.0,86.5,2016,"Romance, Drama",6.423/10,202.0,hi,India,0.0,0.0,Karan Johar,"ADHM Films, Fox Star Studios, Dharma Productions",393445,Ae Dil Hai Mushkil
157,Assassination Classroom: The Graduation,31352921.0,0.0,0.0,31352921.0,100.0,2016,"Science Fiction, Comedy, Action",7.2/10,89.0,ja,Japan,0.0,31383050.0,Eiichirō Hasumi,"Fuji Television Network, J Storm, Robot Communications, Shueisha, TOHO",359628,Assassination Classroom: Graduation
158,Perfect Strangers,31254929.0,0.0,0.0,31254929.0,100.0,2016,"Comedy, Drama",7.867/10,4375.0,it,Italy,0.0,0.0,Álex de la Iglesia,"Nadie es Perfecto, Mediaset España, Pokeepsie Films, Movistar+, Medusa Film, Telecinco Cinema",435126,Perfect Strangers
159,Billy Lynn's Long Halftime Walk,30930984.0,1738477.0,5.6,29192507.0,94.4,2016,"Drama, War",6.021/10,563.0,en,"China, United Kingdom, United States of America",40000000.0,30930984.0,Ang Lee,"Bona Film Group, The Ink Factory, Marc Platt Productions, Studio 8, TriStar Pictures, Film4 Productions, LStar Capital, Haishang Films",293767,Billy Lynn's Long Halftime Walk
160,Pandora,30896701.0,0.0,0.0,30896701.0,100.0,2016,,9.0/10,1.0,ko,,0.0,0.0,Nicolás Andrew,Midnight Moon,1426042,Pandora
161,Norm of the North,30734502.0,17062499.0,55.5,13672003.0,44.5,2016,"Adventure, Animation, Comedy, Family",4.639/10,337.0,en,"India, Ireland, United States of America",7000000.0,17062499.0,Trevor Wall,"Lionsgate, Splash Entertainment, Telegael, Assemblage Entertainment, Mandate International, Dream Factory Group, Discreet Arts Productions",276905,Norm of the North
162,When the Bough Breaks,30658387.0,29747603.0,97.0,910784.0,3.0,2016,"Drama, Thriller",5.9/10,393.0,en,United States of America,10000000.0,30658387.0,Jon Cassar,"Unique Features, Screen Gems",335791,When the Bough Breaks
163,S Storm,30381402.0,0.0,0.0,30381402.0,100.0,2016,"Crime, Action, Thriller",5.7/10,23.0,cn,"China, Hong Kong",0.0,0.0,David Lam Tak-Luk,"Pegasus Motion Pictures, My Pictures Studio, Shanghai Jiaxi Cultural Communications Limited",367195,S Storm
164,Nocturnal Animals,30311857.0,10663357.0,35.2,19648500.0,64.8,2016,"Drama, Thriller",7.426/10,7795.0,en,"United States of America, China",22500000.0,29300000.0,Tom Ford,"Fade to Black, Artina Films, Focus Features, Perfect World Pictures",340666,Nocturnal Animals
165,A Silent Voice: The Movie,30021659.0,310407.0,1.0,29711252.0,99.0,2016,"Animation, Drama",8.384/10,3986.0,ja,Japan,0.0,30819442.0,Naoko Yamada,"Kyoto Animation, ABC Animation, Kodansha, Pony Canyon, Quaras, Shochiku",378064,A Silent Voice: The Movie
166,Keeping Up with the Joneses,29918745.0,14904426.0,49.8,15014319.0,50.2,2016,"Action, Comedy",6.09/10,2012.0,en,United States of America,40000000.0,29900000.0,Greg Mottola,"Parkes+MacDonald Image Nation, Fox 2000 Pictures, TSG Entertainment",331313,Keeping Up with the Joneses
167,Jackie,29777777.0,13960394.0,46.9,15817383.0,53.1,2016,Drama,6.453/10,2295.0,en,"Chile, China, United States of America",9000000.0,13960394.0,Pablo Larraín,"LD Entertainment, Protozoa Pictures, Fabula, Bliss Media",376866,Jackie
168,Masterminds,29674699.0,17368022.0,58.5,12306677.0,41.5,2016,"Action, Comedy, Crime",5.736/10,1731.0,en,United States of America,25000000.0,29200000.0,Jared Hess,"Broadway Video, Relativity Media, Michaels-Goldwyn",213681,Masterminds
169,Flight Crew,29171110.0,0.0,0.0,29171110.0,100.0,2016,Action,7.0/10,270.0,ru,"Cambodia, Russia",10000000.0,27305571.0,Nikolay Lebedev,"Studio Trite, CGF Films, Russia-1, Mosfilm, Cinema Foundation of Russia",380111,Flight Crew
170,Viking,29161298.0,0.0,0.0,29161298.0,100.0,2016,"History, Action, Drama",4.9/10,159.0,ru,Russia,0.0,0.0,Stéphane Lafleur,micro_scope,911345,Viking
171,M.S. Dhoni: The Untold Story,28903047.0,1801550.0,6.2,27101497.0,93.8,2016,Drama,7.148/10,169.0,hi,India,0.0,0.0,Neeraj Pandey,"Fox Star Studios, Inspired Entertainments, Friday Filmworks",388333,M.S. Dhoni: The Untold Story
172,Fan,28240000.0,2300000.0,8.1,25940000.0,91.9,2016,"Action, Adventure, Thriller",6.3/10,249.0,hi,India,12750000.0,28000000.0,Maneesh Sharma,"Red Chillies Entertainment, Yash Raj Films, Prime Focus",377985,Fan
173,"Yôkai Watch: the Movie: The Flying Whale and the Grand Adventure of the Double Worlds, Meow!",28110245.0,0.0,0.0,28110245.0,100.0,2016,,,,,,,,,,N/A,N/A
174,Welcome to Germany,28036021.0,0.0,0.0,28036021.0,100.0,2016,"Comedy, Drama",6.358/10,232.0,de,Germany,0.0,14885722.0,Yasemin Samdereli,"Roxy Film, Infafilm, ZDF",63849,Almanya: Welcome to Germany
175,The Brothers Grimsby,27979040.0,6874837.0,24.6,21104203.0,75.4,2016,"Action, Comedy",5.954/10,2279.0,en,"United Kingdom, United States of America",35000000.0,28000000.0,Louis Leterrier,"Columbia Pictures, LStar Capital, Village Roadshow Pictures, Working Title Films, Big Talk Studios, Four by Two Films",267193,Grimsby
176,When Larry Meets Mary,27863090.0,0.0,0.0,27863090.0,100.0,2016,,,,,,,,,,N/A,N/A
177,Yesterday Once More,27413790.0,0.0,0.0,27413790.0,100.0,2016,"Drama, Romance",7.2/10,12.0,zh,China,0.0,0.0,Gavin Lin,Wanda Pictures,1094457,Yesterday Once More
178,The Light Between Oceans,25975621.0,12545979.0,48.3,13429642.0,51.7,2016,"Drama, Romance",7.1/10,1348.0,en,"India, United Kingdom, United States of America",20000000.0,25975621.0,Derek Cianfrance,"DreamWorks Pictures, Reliance Entertainment, Participant, Heyday Films, Touchstone Pictures",283552,The Light Between Oceans
179,A Beautiful Planet,25730120.0,15650615.0,60.8,10079505.0,39.2,2016,"Documentary, Adventure, Family",6.934/10,68.0,en,United States of America,0.0,24000000.0,Toni Myers,IMAX,365997,A Beautiful Planet
180,Mr. Donkey,25537759.0,356255.0,1.4,25181504.0,98.6,2016,"Comedy, Drama",7.2/10,59.0,zh,China,0.0,356255.0,"Liu Lu, Zhou Shen",Fun Age Pictures,421742,Mr. Donkey
181,Born in China,25081168.0,13873211.0,55.3,11207957.0,44.7,2016,Documentary,7.3/10,160.0,zh,"China, United Kingdom, United States of America",0.0,0.0,Lu Chuan,"Disneynature, Chuan Films",355277,Born in China
182,Race,25070261.0,19206207.0,76.6,5864054.0,23.4,2016,"Drama, History",7.3/10,1524.0,en,"Canada, Germany",5000000.0,24804129.0,Stephen Hopkins,"Trinity Race, Solofilms, Trinica Entertainment, ID+, Mister Smith Entertainment, The Jesse Owens Foundation, Focus Features",323677,Race
183,Call of Heroes,25040561.0,0.0,0.0,25040561.0,100.0,2016,"Action, Thriller",6.32/10,86.0,cn,"China, Hong Kong",32000000.0,0.0,Benny Chan Muk-Sing,"Sun Entertainment Culture, Universe Entertainment, Bona Film Group, iQiyi Motion Pictures",413198,Call of Heroes
184,Free State of Jones,25035950.0,20810036.0,83.1,4225914.0,16.9,2016,"Action, Drama, History, War",6.8/10,1492.0,en,"China, South Korea, United States of America",50000000.0,25035950.0,Gary Ross,"STXfilms, Huayi Brothers Pictures, IM Global, Route One Entertainment, Union Investment Partners, Vendian Entertainment, Bluegrass Films, Rahway Road Productions, Larger Than Life Productions",316152,Free State of Jones
185,Whiskey Tango Foxtrot,24972139.0,23083334.0,92.4,1888805.0,7.6,2016,"Comedy, Drama, War",6.3/10,964.0,en,United States of America,35000000.0,48000000.0,"Glenn Ficarra, John Requa","Paramount Pictures, Broadway Video, Little Stranger",279641,Whiskey Tango Foxtrot
186,Soulmate,24684439.0,0.0,0.0,24684439.0,100.0,2016,"Romance, Drama",7.2/10,68.0,zh,China,30000.0,0.0,"Jay Palmieri Jr., Andrew Froening","FroVideo, 2 Roberts Productions, PL Entertainment",1174019,Soulmate
187,The Snow Queen 3: Fire and Ice,24644317.0,0.0,0.0,24644317.0,100.0,2016,"Family, Animation, Fantasy, Comedy",7.2/10,77.0,ru,Russia,0.0,0.0,Alexey Tsitsilin,Voronezh Animation Studio,362058,The Snow Queen 3: Fire and Ice
188,God's Not Dead 2,24487848.0,20774575.0,84.8,3713273.0,15.2,2016,Drama,6.076/10,403.0,en,United States of America,5000000.0,24487848.0,Harold Cronk,Pure Flix Entertainment,347126,God's Not Dead 2
189,Camping 3,24224579.0,0.0,0.0,24224579.0,100.0,2016,Comedy,4.726/10,582.0,fr,France,0.0,0.0,Fabien Onteniente,"Waiting for Cinéma, TF1 Films Production, Pathé",375804,Camping 3
190,The Founder,24121245.0,12786053.0,53.0,11335192.0,47.0,2016,"Drama, History",7.133/10,4934.0,en,"Greece, United States of America",15000000.0,24121245.0,John Lee Hancock,"Speedie Distribution, FilmNation Entertainment, Faliro House Productions, The Combine, The Weinstein Company",310307,The Founder
191,Bad Santa 2,24079268.0,17782178.0,73.8,6297090.0,26.2,2016,"Comedy, Crime, Mystery",5.412/10,792.0,en,"Canada, United Kingdom, United States of America",26000000.0,24100000.0,Mark Waters,"Ingenious Media, Broad Green Pictures, Miramax",338964,Bad Santa 2
