Rank,Release Group,Name,Budget,$Worldwide,TMDB Revenue,$Domestic,Domestic %,$Foreign,Foreign %,Year,Genres,Rating,Vote_Count,Original_Language,Production_Countries,Directors,Production Companies,Id,Matched
99,Kubo and the Two Strings,Kubo and the Two Strings,60000000,76249438,76249438,48023088,63,28226350,37,2016,"Animation, Adventure, Family",7.635/10,3566,en,United States of America,Travis Knight,Laika,313297,TRUE
100,Quo vado?,Where Am I Going?,11089000,75878701,75173000,0,0,75878701,100,2016,Comedy,6.829/10,2112,it,Italy,Gennaro Nunziante,"Taodue Film, Mediaset Premium",374416,FALSE
101,Boo! A Madea Halloween,Boo! A Madea Halloween,20000000,74827344,74827344,73206343,97.8,1621001,2.2,2016,Comedy,5.7/10,411,en,United States of America,Tyler Perry,"Lionsgate, Tyler Perry Studios",380124,TRUE
102,Miracles from Heaven,Miracles from Heaven,16000000,73983003,74000000,61705123,83.4,12277880,16.6,2016,"Family, Drama",7.4/10,1187,en,United States of America,Patricia Riggen,"Columbia Pictures, Affirm Films, Roth Films, Franklin Entertainment, Sony Pictures",339984,TRUE
103,The Nice Guys,The Nice Guys,50000000,71261763,71261763,36261763,50.9,35000000,49.1,2016,"Comedy, Crime, Action",7.121/10,7915,en,United States of America,Shane Black,"Silver Pictures, Waypoint Entertainment",290250,TRUE
104,I Am Not Madame Bovary,I Am Not Madame Bovary,0,70826207,0,436798,0.6,70389409,99.4,2016,"Comedy, Drama",6.88/10,83,zh,China,Feng Xiaogang,"Huayi Brothers Pictures, Beijing Culture",400114,TRUE
105,See You Tomorrow,See You Tomorrow,0,70065569,0,0,0,70065569,100,2016,"Comedy, Drama, Romance",4.3/10,16,cn,"China, Hong Kong",Andrea Zaccariello,Moviemax,169683,TRUE
106,One Piece Film: Gold,One Piece Film: GOLD,0,66207073,66207073,423593,0.6,65783480,99.4,2016,"Action, Animation, Adventure, Comedy",7.202/10,485,ja,Japan,Hiroaki Miyamoto,"Fuji Television Network, Funimation Global Group, Toei Animation, Toei Company, Shueisha, Bandai, Bandai Namco Entertainment",374205,TRUE
107,Moonlight,Moonlight,4000000,65172611,65046687,27854932,42.7,37317679,57.3,2016,Drama,7.379/10,7037,en,United States of America,Barry Jenkins,"A24, Plan B Entertainment, PASTEL",376867,TRUE
108,Monster Trucks,Monster Trucks,125000000,64493915,64493915,33370166,51.7,31123749,48.3,2016,"Action, Comedy, Science Fiction",6.103/10,853,en,United States of America,Chris Wedge,"Nickelodeon Movies, Paramount Pictures, Disruption Entertainment, Paramount Animation",262841,TRUE
109,Fences,Fences,24000000,64414761,64400000,57682904,89.5,6731857,10.5,2016,Drama,6.862/10,2604,en,"Canada, United States of America",Denzel Washington,"Paramount Pictures, Scott Rudin Productions, MACRO, Bron Studios, Escape Artists",393457,TRUE
110,"Hail, Caesar!","Hail, Caesar!",22000000,63647656,63647656,30498085,47.9,33149571,52.1,2016,"Comedy, Crime, Mystery",5.92/10,3750,en,"United Kingdom, United States of America","Joel Coen, Ethan Coen","Universal Pictures, Mike Zoss Productions, Working Title Films",270487,TRUE
111,Chongqing Hot Pot,Chongqing Hot Pot,0,58106427,0,779818,1.3,57326609,98.7,2016,Drama,6.3/10,57,zh,China,Yang Qing,"New Classics Media, Wanda Pictures, CKF Pictures",388403,TRUE
112,L.O.R.D: Legend of Ravaging Dynasties,L.O.R.D: Legend of Ravaging Dynasties 2,0,58089494,0,350456,0.6,57739038,99.4,2016,"Animation, Fantasy, Drama, Science Fiction",7.0/10,132,zh,China,Guo Jingming,,630044,FALSE
113,Nine Lives,Nine Lives,0,57814445,0,19700032,34.1,38114413,65.9,2016,"Fantasy, Comedy, Family",5.8/10,1066,en,"China, France",Rodrigo García,"Mockingbird Pictures, Z Films",16022,TRUE
114,Zoolander 2,Zoolander 2,50000000,56722693,56722693,28848693,50.9,27874000,49.1,2016,"Comedy, Adventure, Action",4.923/10,2226,en,United States of America,Ben Stiller,"Paramount Pictures, Red Hour, Scott Rudin Productions",329833,TRUE
115,Barbershop: The Next Cut,Barbershop: The Next Cut,20000000,55630051,55030051,54030051,97.1,1600000,2.9,2016,"Comedy, Drama",6.31/10,458,en,United States of America,Malcolm D. Lee,"New Line Cinema, Cube Vision, Metro-Goldwyn-Mayer, Warner Bros. Pictures",326423,TRUE
116,The Age of Shadows,The Age of Shadows,9620000,54491162,53165427,541719,1,53949443,99,2016,"Action, Thriller",7.2/10,327,ko,South Korea,Kim Jee-woon,"Harbin, Warner Bros. Korea, Dark Circle Pictures",363579,TRUE
117,A Chinese Odyssey: Part Three,A Chinese Odyssey Part Three,0,53306108,0,0,0,53306108,100,2016,"Adventure, Comedy, Family, Fantasy",6.2/10,15,zh,China,Jeffrey Lau Chun-wai,Chunqiu Time Co.,389201,FALSE
118,Tunnel,Tunnel,0,52444295,0,568876,1.1,51875419,98.9,2016,"Crime, Thriller",7.049/10,398,es,"Spain, Argentina",Daniel Baldwin,"Edgar Entertainment, Caledonia Pictures, City Heat Productions",160808,TRUE
119,Patriots Day,Patriots Day,45000000,52185751,50548152,31886361,61.1,20299390,38.9,2016,"Action, Crime, Drama, History, Thriller",7.052/10,2604,en,"Hong Kong, United States of America",Peter Berg,"TIK Films, CBS Films, Closest to the Hole Productions, Bluegrass Films, Hutch Parker Entertainment, Leverage Entertainment, Lionsgate",388399,TRUE
120,My Beloved Bodyguard,The Bodyguard,0,52165873,0,0,0,52165873,100,2016,"Action, Crime",5.8/10,74,zh,"China, Hong Kong, Malaysia",Sammo Hung Kam-Bo,"Edko Films, Focus Films Limited, Tencent Penguin Pictures, Irresistible Alpha Limited, BDI Films Inc., Good Friends Entertainment, Lava Bear Films",315669,FALSE
121,The Finest Hours,The Finest Hours,80000000,52099090,52099090,27569558,52.9,24529532,47.1,2016,"Action, Drama, History, Thriller",6.6/10,1598,en,United States of America,Craig Gillespie,"Red Hawk Entertainment, Walt Disney Pictures, Whitaker Entertainment, Bergsten Music",300673,TRUE
122,Master,Master,0,51636415,0,597251,1.2,51039164,98.8,2016,"Action, Comedy",7.395/10,947,cn,Hong Kong,Mariama Diallo,"Amazon Studios, Animal Kingdom, Big Indie Pictures",680829,TRUE
123,Doraemon the Movie: Nobita and the Birth of Japan,Doraemon: Nobita and the Birth of Japan,0,50939840,58400000,0,0,50939840,100,2016,"Animation, Adventure, Fantasy, Science Fiction, Family",6.754/10,59,ja,Japan,Shinnosuke Yakuwa,"TOHO, TV Asahi, Fujiko Productions, Marbean Animation, Shin-Ei Animation, Next Entertainment World, Zoom (KR), Daewon Media",384345,FALSE
124,The Wailing,The Wailing,0,49851770,0,786633,1.6,49065137,98.4,2016,"Horror, Mystery",7.354/10,1731,ko,"South Korea, United States of America",Pedro Martín Calero,"Tandem Films, Setembro Cine, Caballo Films, Tarea Fina, Noodles Production, El Llanto",1299372,TRUE
125,Two Is a Family,Two Is a Family,0,49619118,1447740,0,0,49619118,100,2016,"Drama, Comedy",7.744/10,2965,fr,"France, United Kingdom",Hugo Gélin,"Mars Films, Poisson Rouge Pictures, TF1 Films Production, Korokoro, Vendôme Production",382591,TRUE
126,Never Gone,So Young 2: Never Gone,0,48980792,0,96421,0.2,48884371,99.8,2016,"Comedy, Drama, Romance",6.4/10,50,zh,China,Zhou Tuo Ru,,405755,FALSE
127,Luck-Key,Luck-Key,0,48913975,0,466505,1,48447470,99,2016,"Action, Comedy, Crime",7.1/10,129,ko,South Korea,Lee Kae-byeok,"Yong Film, Showbox",421928,TRUE
128,Florence Foster Jenkins,Florence Foster Jenkins,29000000,48902953,48902953,27383770,56,21519183,44,2016,"Comedy, Drama",6.666/10,1449,en,"United Kingdom, United States of America",Stephen Frears,"BBC Film, Qwerty Films, Pathé",315664,TRUE
129,Mother's Day,Mother's Day,0,48782670,0,32492859,66.6,16289811,33.4,2016,"Comedy, Drama, Romance",6.0/10,1262,en,United States of America,Mateusz Rakowicz,"Akson Studio, Chimney Poland, Łódzkie Centrum Filmowe",1107872,TRUE
130,"Yo-kai Watch Movie: It's the Secret of Birth, Meow! 2016 Re-release",N/A,,47642462,,0,0,47642462,100,2016,,,,,,,,N/A,FALSE
131,A Monster Calls,A Monster Calls,43000000,47309313,47300000,3740823,7.9,43568490,92.1,2016,"Drama, Fantasy, Adventure, Family, Animation, Horror",7.3/10,3305,en,"Spain, United States of America",J.A. Bayona,"River Road Entertainment, Participant, Apaches Films, La Trini, A Monster Calls AIE, Telecinco Cinema, Summit Entertainment, Focus Features",258230,TRUE
132,Risen,Risen,0,46432579,0,36880033,79.4,9552546,20.6,2016,"Action, Adventure, Drama, Fantasy",6.184/10,828,en,United States of America,Eddie Arya,"Aryavision Pictures, Vertical",850099,TRUE
133,Eddie the Eagle,Eddie the Eagle,23000000,46152800,46152411,15789389,34.2,30363411,65.8,2016,"Comedy, Drama, History, Adventure",7.168/10,2109,en,"Germany, United Kingdom, United States of America",Dexter Fletcher,"Studio Babelsberg, Marv, Saville Productions",319888,TRUE
134,Blair Witch,Blair Witch,5000000,45173154,45172994,20777061,46,24396093,54,2016,"Thriller, Horror",5.223/10,1903,en,"Canada, United States of America",Adam Wingard,"Vertigo Entertainment, Lionsgate, Room 101, Snoot Entertainment",351211,TRUE
135,Boonie Bears: The Big Top Secret,Boonie Bears: The Big Top Secret,0,45150390,45150390,0,0,45150390,100,2016,"Animation, Adventure, Comedy",7.2/10,17,zh,,"Ding Liang, Yongchang Lin",,401791,TRUE
136,Café Society,Café Society,30000000,43763247,43763247,11103205,25.4,32660042,74.6,2016,"Comedy, Drama, Romance",6.457/10,2680,en,United States of America,Woody Allen,"Perdido Productions, Gravier Productions",339397,TRUE
137,League of Gods,League of Gods,38000000,43498766,43300000,181633,0.4,43317133,99.6,2016,"Action, Fantasy",5.6/10,152,zh,"China, Hong Kong",Koan Hui On,"China Star Entertainment, Huayi Brothers Pictures",406429,TRUE
138,Almost Christmas,An Almost Christmas Story,0,42580920,0,42158780,99,422140,1,2016,"Comedy, Drama",5.9/10,362,en,United States of America,David Lowery,"Esperanto Filmoj, Titmouse, Maere Studios, Disney Branded Television",1355755,FALSE
139,The Witch,The Witch,4000000,40423945,40423945,25138705,62.2,15285240,37.8,2016,"Horror, Drama, Mystery",6.973/10,6965,en,"Brazil, Canada, United Kingdom, United States of America",Robert Eggers,"Very Special Projects, Parts & Labor, RT Features, Rooks Nest Entertainment, Maiden Voyage Pictures, Pulse Films, Scythia Films, Code Red Productions, Mott Street Pictures",310131,TRUE
140,The Wild Life,The Wild Life,0,40075446,9500000,8005586,20,32069860,80,2016,"Animation, Adventure, Comedy, Family",5.798/10,332,de,"Belgium, France, United States of America",Art Linson,Universal Pictures,38980,TRUE
141,Love O2O,Love O2O,0,39969537,39969537,0,0,39969537,100,2016,"Drama, Comedy, Romance",6.6/10,52,zh,China,Tianyu Zhao,,412190,TRUE
142,The Forest,The Forest,10000000,39712000,37608299,26594261,67,13117739,33,2016,"Horror, Thriller, Mystery",5.232/10,1735,en,United States of America,Jason Zada,"Lava Bear Films, AI Film, Phantom Four",329440,TRUE
143,Absolutely Fabulous: The Movie,Absolutely Fabulous: The Movie,0,39219109,37915971,4772155,12.2,34446954,87.8,2016,Comedy,5.3/10,241,en,United Kingdom,Mandie Fletcher,"British Film Company, Fox Searchlight Pictures",372411,TRUE
144,My Mom Is a Character 2,My Mom Is a Character 2,2000000,39195565,39195565,0,0,39195565,100,2016,Comedy,7.7/10,497,pt,Brazil,César Rodrigues,"Migdal Filmes, Globo Filmes, Paris Filmes, Downtown Filmes, Universal Pictures International, Paramount Pictures Brasil, DiamondBack",227932,TRUE
145,Masterpiece Mystery: Sherlock: The Abominable Bride,N/A,,39139204,,0,0,39139204,100,2016,,,,,,,,N/A,FALSE
146,"Crouching Tiger, Hidden Dragon: Sword of Destiny","Crouching Tiger, Hidden Dragon: Sword of Destiny",20000000,38659039,38659039,0,0,38659039,100,2016,"Action, Adventure, Drama",6.102/10,643,en,China,Yuen Woo-Ping,"The Weinstein Company, Yucaipa Films, Pegasus Taihe Entertainment",263341,TRUE
147,Hell or High Water,Hell or High Water,12000000,37879877,37600000,27007844,71.3,10872033,28.7,2016,"Western, Crime, Drama",7.3/10,4444,en,United States of America,David Mackenzie,"Sidney Kimmel Entertainment, Film 44, OddLot Entertainment, Estrella Media, Lionsgate, CBS Films, Sierra/Affinity",338766,TRUE
148,Mission Milano,Mission Milano,0,37749848,0,0,0,37749848,100,2016,"Action, Comedy",6.1/10,14,cn,"Hong Kong, China",Wong Jing,"Mega-Vision Pictures (MVP), Gravity Pictures, Aim Media Co",419544,TRUE
149,The Handmaiden,The Handmaiden,8575000,37692886,38600000,2006788,5.3,35686098,94.7,2016,"Thriller, Drama, Romance",8.214/10,3767,ko,South Korea,Park Chan-wook,"Moho Film, Yong Film, CJ Entertainment",290098,TRUE
150,Snowden,Snowden,40000000,37357216,37357216,21587519,57.8,15769697,42.2,2016,"Drama, History, Crime, Thriller",7.107/10,4321,en,"France, Germany, United States of America",Oliver Stone,"KrautPack Entertainment, Vendian Entertainment, Endgame Entertainment, Wild Bunch, Open Road Films, TG Media",302401,TRUE
151,Nobunaga Concerto: The Movie,Nobunaga Concerto: The Movie,0,36187594,0,0,0,36187594,100,2016,"Action, Comedy, Science Fiction",6.6/10,21,ja,Japan,Hiroaki Matsuyama,Fuji Television Network,361358,TRUE
152,Eye in the Sky,Eye in the Sky,13000000,35259653,18704595,18704595,53,16555058,47,2016,"Drama, Thriller, War",7.019/10,1568,en,United Kingdom,Gavin Hood,"Raindog Films, Entertainment One Features",333352,TRUE
153,The Tuche Family: The American Dream,The Tuche Family: The American Dream,0,35210425,0,0,0,35210425,100,2016,Comedy,5.6/10,948,fr,France,Olivier Baroux,"Pathé Distribution, Pathé Productions, TF1 Films Production",369776,TRUE
154,Os Dez Mandamentos - O Filme,The Ten Commandments: The Movie,39307171,31998251,37070177,0,0,31998251,100,2016,Drama,7.2/10,305,pt,"Brazil, Morocco",Alexandre Avancini,"Downtown Filmes, Record, Record Filmes, Paris Filmes",372519,FALSE
155,Bounty Hunters,Bounty Hunters,0,31918573,0,0,0,31918573,100,2016,"Action, Adventure, Comedy, Drama",7.1/10,53,zh,"Hong Kong, China, South Korea",Shin Terra,Pegasus Motion Pictures,388764,TRUE
156,Ae Dil Hai Mushkil,Ae Dil Hai Mushkil,0,31668920,0,4264983,13.5,27403937,86.5,2016,"Romance, Drama",6.423/10,202,hi,India,Karan Johar,"ADHM Films, Fox Star Studios, Dharma Productions",393445,TRUE
157,Assassination Classroom: The Graduation,Assassination Classroom: Graduation,0,31352921,31383050,0,0,31352921,100,2016,"Science Fiction, Comedy, Action",7.2/10,89,ja,Japan,Eiichirō Hasumi,"Fuji Television Network, J Storm, Robot Communications, Shueisha, TOHO",359628,FALSE
158,Perfect Strangers,Perfect Strangers,0,31254929,0,0,0,31254929,100,2016,"Comedy, Drama",7.867/10,4375,it,Italy,Álex de la Iglesia,"Nadie es Perfecto, Mediaset España, Pokeepsie Films, Movistar+, Medusa Film, Telecinco Cinema",435126,TRUE
159,Billy Lynn's Long Halftime Walk,Billy Lynn's Long Halftime Walk,40000000,30930984,30930984,1738477,5.6,29192507,94.4,2016,"Drama, War",6.021/10,563,en,"China, United Kingdom, United States of America",Ang Lee,"Bona Film Group, The Ink Factory, Marc Platt Productions, Studio 8, TriStar Pictures, Film4 Productions, LStar Capital, Haishang Films",293767,TRUE
160,Pandora,Pandora,0,30896701,0,0,0,30896701,100,2016,,9.0/10,1,ko,,Nicolás Andrew,Midnight Moon,1426042,TRUE
161,Norm of the North,Norm of the North,7000000,30734502,17062499,17062499,55.5,13672003,44.5,2016,"Adventure, Animation, Comedy, Family",4.639/10,337,en,"India, Ireland, United States of America",Trevor Wall,"Lionsgate, Splash Entertainment, Telegael, Assemblage Entertainment, Mandate International, Dream Factory Group, Discreet Arts Productions",276905,TRUE
162,When the Bough Breaks,When the Bough Breaks,10000000,30658387,30658387,29747603,97,910784,3,2016,"Drama, Thriller",5.9/10,393,en,United States of America,Jon Cassar,"Unique Features, Screen Gems",335791,TRUE
163,S Storm,S Storm,0,30381402,0,0,0,30381402,100,2016,"Crime, Action, Thriller",5.7/10,23,cn,"China, Hong Kong",David Lam Tak-Luk,"Pegasus Motion Pictures, My Pictures Studio, Shanghai Jiaxi Cultural Communications Limited",367195,TRUE
164,Nocturnal Animals,Nocturnal Animals,22500000,30311857,29300000,10663357,35.2,19648500,64.8,2016,"Drama, Thriller",7.426/10,7795,en,"United States of America, China",Tom Ford,"Fade to Black, Artina Films, Focus Features, Perfect World Pictures",340666,TRUE
165,A Silent Voice: The Movie,A Silent Voice: The Movie,0,30021659,30819442,310407,1,29711252,99,2016,"Animation, Drama",8.384/10,3986,ja,Japan,Naoko Yamada,"Kyoto Animation, ABC Animation, Kodansha, Pony Canyon, Quaras, Shochiku",378064,TRUE
166,Keeping Up with the Joneses,Keeping Up with the Joneses,40000000,29918745,29900000,14904426,49.8,15014319,50.2,2016,"Action, Comedy",6.09/10,2012,en,United States of America,Greg Mottola,"Parkes+MacDonald Image Nation, Fox 2000 Pictures, TSG Entertainment",331313,TRUE
167,Jackie,Jackie,9000000,29777777,13960394,13960394,46.9,15817383,53.1,2016,Drama,6.453/10,2295,en,"Chile, China, United States of America",Pablo Larraín,"LD Entertainment, Protozoa Pictures, Fabula, Bliss Media",376866,TRUE
168,Masterminds,Masterminds,25000000,29674699,29200000,17368022,58.5,12306677,41.5,2016,"Action, Comedy, Crime",5.736/10,1731,en,United States of America,Jared Hess,"Broadway Video, Relativity Media, Michaels-Goldwyn",213681,TRUE
169,Flight Crew,Flight Crew,10000000,29171110,27305571,0,0,29171110,100,2016,Action,7.0/10,270,ru,"Cambodia, Russia",Nikolay Lebedev,"Studio Trite, CGF Films, Russia-1, Mosfilm, Cinema Foundation of Russia",380111,TRUE
170,Viking,Viking,0,29161298,0,0,0,29161298,100,2016,"History, Action, Drama",4.9/10,159,ru,Russia,Stéphane Lafleur,micro_scope,911345,TRUE
171,M.S. Dhoni: The Untold Story,M.S. Dhoni: The Untold Story,0,28903047,0,1801550,6.2,27101497,93.8,2016,Drama,7.148/10,169,hi,India,Neeraj Pandey,"Fox Star Studios, Inspired Entertainments, Friday Filmworks",388333,TRUE
172,Fan,Fan,12750000,28240000,28000000,2300000,8.1,25940000,91.9,2016,"Action, Adventure, Thriller",6.3/10,249,hi,India,Maneesh Sharma,"Red Chillies Entertainment, Yash Raj Films, Prime Focus",377985,TRUE
173,"Yôkai Watch: the Movie: The Flying Whale and the Grand Adventure of the Double Worlds, Meow!",N/A,,28110245,,0,0,28110245,100,2016,,,,,,,,N/A,FALSE
174,Welcome to Germany,Almanya: Welcome to Germany,0,28036021,14885722,0,0,28036021,100,2016,"Comedy, Drama",6.358/10,232,de,Germany,Yasemin Samdereli,"Roxy Film, Infafilm, ZDF",63849,FALSE
175,The Brothers Grimsby,Grimsby,35000000,27979040,28000000,6874837,24.6,21104203,75.4,2016,"Action, Comedy",5.954/10,2279,en,"United Kingdom, United States of America",Louis Leterrier,"Columbia Pictures, LStar Capital, Village Roadshow Pictures, Working Title Films, Big Talk Studios, Four by Two Films",267193,FALSE
176,When Larry Meets Mary,N/A,,27863090,,0,0,27863090,100,2016,,,,,,,,N/A,FALSE
177,Yesterday Once More,Yesterday Once More,0,27413790,0,0,0,27413790,100,2016,"Drama, Romance",7.2/10,12,zh,China,Gavin Lin,Wanda Pictures,1094457,TRUE
178,The Light Between Oceans,The Light Between Oceans,20000000,25975621,25975621,12545979,48.3,13429642,51.7,2016,"Drama, Romance",7.1/10,1348,en,"India, United Kingdom, United States of America",Derek Cianfrance,"DreamWorks Pictures, Reliance Entertainment, Participant, Heyday Films, Touchstone Pictures",283552,TRUE
179,A Beautiful Planet,A Beautiful Planet,0,25730120,24000000,15650615,60.8,10079505,39.2,2016,"Documentary, Adventure, Family",6.934/10,68,en,United States of America,Toni Myers,IMAX,365997,TRUE
180,Mr. Donkey,Mr. Donkey,0,25537759,356255,356255,1.4,25181504,98.6,2016,"Comedy, Drama",7.2/10,59,zh,China,"Liu Lu, Zhou Shen",Fun Age Pictures,421742,TRUE
181,Born in China,Born in China,0,25081168,0,13873211,55.3,11207957,44.7,2016,Documentary,7.3/10,160,zh,"China, United Kingdom, United States of America",Lu Chuan,"Disneynature, Chuan Films",355277,TRUE
182,Race,Race,5000000,25070261,24804129,19206207,76.6,5864054,23.4,2016,"Drama, History",7.3/10,1524,en,"Canada, Germany",Stephen Hopkins,"Trinity Race, Solofilms, Trinica Entertainment, ID+, Mister Smith Entertainment, The Jesse Owens Foundation, Focus Features",323677,TRUE
183,Call of Heroes,Call of Heroes,32000000,25040561,0,0,0,25040561,100,2016,"Action, Thriller",6.32/10,86,cn,"China, Hong Kong",Benny Chan Muk-Sing,"Sun Entertainment Culture, Universe Entertainment, Bona Film Group, iQiyi Motion Pictures",413198,TRUE
184,Free State of Jones,Free State of Jones,50000000,25035950,25035950,20810036,83.1,4225914,16.9,2016,"Action, Drama, History, War",6.8/10,1492,en,"China, South Korea, United States of America",Gary Ross,"STXfilms, Huayi Brothers Pictures, IM Global, Route One Entertainment, Union Investment Partners, Vendian Entertainment, Bluegrass Films, Rahway Road Productions, Larger Than Life Productions",316152,TRUE
185,Whiskey Tango Foxtrot,Whiskey Tango Foxtrot,35000000,24972139,48000000,23083334,92.4,1888805,7.6,2016,"Comedy, Drama, War",6.3/10,964,en,United States of America,"Glenn Ficarra, John Requa","Paramount Pictures, Broadway Video, Little Stranger",279641,TRUE
186,Soulmate,Soulmate,30000,24684439,0,0,0,24684439,100,2016,"Romance, Drama",7.2/10,68,zh,China,"Jay Palmieri Jr., Andrew Froening","FroVideo, 2 Roberts Productions, PL Entertainment",1174019,TRUE
187,The Snow Queen 3: Fire and Ice,The Snow Queen 3: Fire and Ice,0,24644317,0,0,0,24644317,100,2016,"Family, Animation, Fantasy, Comedy",7.2/10,77,ru,Russia,Alexey Tsitsilin,Voronezh Animation Studio,362058,TRUE
188,God's Not Dead 2,God's Not Dead 2,5000000,24487848,24487848,20774575,84.8,3713273,15.2,2016,Drama,6.076/10,403,en,United States of America,Harold Cronk,Pure Flix Entertainment,347126,TRUE
189,Camping 3,Camping 3,0,24224579,0,0,0,24224579,100,2016,Comedy,4.726/10,582,fr,France,Fabien Onteniente,"Waiting for Cinéma, TF1 Films Production, Pathé",375804,TRUE
190,The Founder,The Founder,15000000,24121245,24121245,12786053,53,11335192,47,2016,"Drama, History",7.133/10,4934,en,"Greece, United States of America",John Lee Hancock,"Speedie Distribution, FilmNation Entertainment, Faliro House Productions, The Combine, The Weinstein Company",310307,TRUE
191,Bad Santa 2,Bad Santa 2,26000000,24079268,24100000,17782178,73.8,6297090,26.2,2016,"Comedy, Crime, Mystery",5.412/10,792,en,"Canada, United Kingdom, United States of America",Mark Waters,"Ingenious Media, Broad Green Pictures, Miramax",338964,TRUE
192,Spirits' Homecoming,Spirits' Homecoming,0,23857217,0,125616,0.5,23731601,99.5,2016,"Drama, History",7.3/10,26,ko,South Korea,Cho Jung-lae,"JO Entertainment, WAW Pictures",384641,TRUE
193,Silence,Silence,46000000,23834809,23834809,7100177,29.8,16734632,70.2,2016,"Drama, History",7.13/10,3046,en,"Mexico, Taiwan, United States of America",Martin Scorsese,"Waypoint Entertainment, Cappa Defina Productions, CatchPlay, Fábrica de Cine, SharpSword Films, Sikelia Productions, EFO Films",68730,TRUE
194,Kevin Hart: What Now?,Kevin Hart: What Now?,9900000,23591043,23600000,23591043,100,0,0,2016,"Comedy, Documentary, TV Movie",6.479/10,243,en,United States of America,"Leslie Small, Tim Story","Universal Pictures, HartBeat Productions",339927,TRUE
195,No Manches Frida,"No manches, Frida",5000000,23540937,23500000,11528613,49,12012324,51,2016,Comedy,7.683/10,882,es,Mexico,Nacho G. Velilla,"Videocine, Pantelion Films, Alcon Entertainment, Constantin Film, Neverending Media, Epoca Films, Televisa",375794,FALSE
196,Middle School: The Worst Years of My Life,Middle School: The Worst Years of My Life,8500000,23316139,23316139,20007149,85.8,3308990,14.2,2016,"Family, Comedy",6.922/10,417,en,United States of America,Steve Carr,"Lionsgate, CBS Films, Participant",369883,TRUE
197,Triple 9,Triple 9,20000000,23177948,12600000,12639297,54.5,10538651,45.5,2016,"Action, Crime, Adventure, Thriller",5.978/10,2126,en,United States of America,John Hillcoat,"Surefire Capital, Worldview Entertainment, Sierra Pictures, Anonymous Content, MadRiver Pictures",146198,TRUE
198,Rock Dog,Rock Dog,60000000,23139802,23270926,9420546,40.7,13719256,59.3,2016,"Animation, Adventure, Comedy, Family, Music",6.2/10,288,en,"China, United States of America",Ash Brannon,"Dream Factory Group, Reel FX Creative Studios, Mandoo Pictures, Eracme Entertainment, Summit Entertainment, Huayi Brothers Pictures, Tencent Pictures",333667,TRUE
199,The Choice,The Choice,10000000,23064015,23730891,18730891,81.2,4333124,18.8,2016,"Drama, Romance",7.2/10,1887,en,United States of America,Ross Katz,"Lionsgate, Nicholas Sparks Productions, The Safran Company, Good Universe",330483,TRUE
200,Penny Pincher!,Penny Pincher!,0,22955486,0,0,0,22955486,100,2016,Comedy,5.575/10,906,fr,"France, Spain",Fred Cavayé,"TF1, Mars Films, Canal+, Ciné+, TF1 Films Production, Jerico Films, Meñakoz Films, TF1 International",382511,TRUE
1,Star Wars: Episode VIII - The Last Jedi,Star Wars: The Last Jedi,200000000,1332539889,1332698830,620181382,46.5,712358507,53.5,2017,"Adventure, Action, Science Fiction",6.788/10,15319,en,United States of America,Rian Johnson,Lucasfilm Ltd.,181808,FALSE
2,Beauty and the Beast,Beauty and the Beast,25000000,1263521126,424967620,504014165,39.9,759506961,60.1,2017,"Family, Fantasy, Romance",6.971/10,15454,en,United States of America,"Gary Trousdale, Kirk Wise","Walt Disney Pictures, Silver Screen Partners IV, Walt Disney Feature Animation",10020,TRUE
3,The Fate of the Furious,The Fate of the Furious,250000000,1236005118,1236000000,226008385,18.3,1009996733,81.7,2017,"Action, Crime, Thriller",6.869/10,10282,en,United States of America,F. Gary Gray,"Original Film, One Race, Universal Pictures",337339,TRUE
4,Despicable Me 3,Despicable Me 2: 3 Mini-Movie Collection,0,1034799409,0,264624300,25.6,770175109,74.4,2017,"Action, Animation, Comedy, Family, Adventure",6.468/10,7166,en,United States of America,"Yarrow Cheney, Bruno Dequier, Fabrice Joubert, Mark O'Hare, Eric Favela, Régis Schuller",,326396,FALSE
5,Jumanji: Welcome to the Jungle,Jumanji: Welcome to the Jungle,90000000,962077546,995339117,404515480,42,557562066,58,2017,"Adventure, Comedy, Fantasy",6.824/10,13624,en,United States of America,Jake Kasdan,"Matt Tolmach Productions, Seven Bucks Productions, Columbia Pictures",353486,TRUE
