Rank,Release Group,Name,Budget,$Worldwide,TMDB Revenue,$Domestic,Domestic %,$Foreign,Foreign %,Year,Genres,Rating,Vote_Count,Original_Language,Production_Countries,Directors,Production Companies,Id,Matched
10,Jumanji: The Next Level,Jumanji: The Next Level,125000000,801693929,801693929,320314960,40,481378969,60,2019,"Adventure, Comedy, Fantasy",6.9/10,8670,en,United States of America,Jake Kasdan,"Columbia Pictures, Seven Bucks Productions, Matt Tolmach Productions, The Detective Agency",512200,TRUE
11,Fast & Furious Presents: Hobbs & Shaw,Fast X,340000000,760732926,704709660,173956935,22.9,586775991,77.1,2019,"Action, Adventure, Comedy",6.861/10,7207,en,United States of America,Louis Leterrier,"Universal Pictures, Original Film, One Race, Perfect Storm Entertainment",385687,FALSE
12,Ne Zha,Ne Zha 2,80000000,726024868,2114000000,3695533,0.5,722329335,99.5,2019,"Animation, Fantasy, Adventure",7.9/10,402,zh,China,Yang Yu,"Chengdu Coco Cartoon, Beijing Enlight Pictures, Chengdu Enlight Animation, Coloroom Pictures",980477,FALSE
13,The Wandering Earth,The Wandering Earth,48000000,699856699,0,5971413,0.9,693885286,99.1,2019,"Science Fiction, Action, Drama",6.616/10,968,zh,China,Frant Gwo,"China Film Group Corporation, Beijing Jingxi Culture, DF Pictures, G!Film Studio, Free Whale Pictures",535167,TRUE
14,How to Train Your Dragon: The Hidden World,How to Train Your Dragon: The Hidden World,129000000,521799505,524580592,160799505,30.8,361000000,69.2,2019,"Animation, Family, Adventure",7.751/10,6425,en,United States of America,Dean DeBlois,"DreamWorks Animation, Mad Hatter Entertainment",166428,TRUE
15,Maleficent: Mistress of Evil,Maleficent: Mistress of Evil,185000000,491730089,491730089,113929605,23.2,377800484,76.8,2019,"Family, Fantasy, Adventure, Action",7.303/10,6107,en,United States of America,Joachim Rønning,"Walt Disney Pictures, Roth Films",420809,TRUE
16,It Chapter Two,It Chapter Two,79000000,473093228,473123154,211593228,44.7,261500000,55.3,2019,"Horror, Drama, Thriller",6.842/10,8761,en,United States of America,Andy Muschietti,"New Line Cinema, Vertigo Entertainment, Double Dream, Rideback",474350,TRUE
17,"My People, My Country","My People, My Country",0,450064993,450064993,2356683,0.5,447708310,99.5,2019,"Drama, History",6.8/10,62,zh,"China, Hong Kong","Chen Kaige, Zhang Yibai, Guan Hu, Xiaolu Xue, Xu Zheng, Ning Hao, Wen Muye","Huaxia Film Distribution, Bona Film Group, Alibaba Pictures Group, Emperor Film Production, Beijing Enlight Pictures",612845,TRUE
18,Pokémon: Detective Pikachu,Pokémon Detective Pikachu,150000000,433305346,449762638,144105346,33.3,289200000,66.7,2019,"Action, Adventure, Fantasy",6.927/10,6849,en,"Japan, United States of America",Rob Letterman,"Legendary Pictures, The Pokémon Company, TOHO",447404,FALSE
19,The Secret Life of Pets 2,The Secret Life of Pets 2,80000000,431164459,429434163,158980250,36.9,272184209,63.1,2019,"Adventure, Animation, Comedy, Family",7.0/10,3038,en,United States of America,Chris Renaud,"Universal Pictures, Illumination",412117,TRUE
20,The Captain,Captain America: The Winter Soldier,170000000,417863545,714766572,706572,0.2,417156973,99.8,2019,"Action, Animation, Comedy, Family",6.225/10,1211,en,United States of America,"Joe Russo, Anthony Russo",Marvel Studios,100402,FALSE
21,Alita: Battle Angel,Alita: Battle Angel,170000000,404980543,405000000,85838210,21.2,319142333,78.8,2019,"Action, Science Fiction, Adventure",7.241/10,9171,en,United States of America,Robert Rodriguez,"Troublemaker Studios, Lightstorm Entertainment, 20th Century Fox, TSG Entertainment",399579,TRUE
22,Godzilla: King of the Monsters,Godzilla: King of the Monsters,170000000,387300138,387300138,110500138,28.5,276800000,71.5,2019,"Science Fiction, Action",6.7/10,6184,en,"China, Japan, United States of America",Michael Dougherty,"Legendary Pictures, Huahua Media, TOHO",373571,TRUE
23,1917,1917,100000000,384580017,394638258,159227644,41.4,225352373,58.6,2019,"War, History, Thriller, Drama",8.0/10,12433,en,"India, Spain, United Kingdom, United States of America",Sam Mendes,"DreamWorks Pictures, Reliance Entertainment, New Republic Pictures, Neal Street Productions, Mogambo Films, Amblin Partners",530915,TRUE
24,Once Upon a Time... in Hollywood,Once Upon a Time... in Hollywood,95000000,377426903,392105159,142502728,37.8,234924175,62.2,2019,"Comedy, Drama, Thriller",7.4/10,13492,en,"China, United Kingdom, United States of America",Quentin Tarantino,"Heyday Films, Columbia Pictures, Bona Film Group",466272,TRUE
25,Shazam!,Shazam!,80000000,365971656,367799011,140371656,38.4,225600000,61.6,2019,"Action, Comedy, Fantasy",7.001/10,9539,en,United States of America,David F. Sandberg,"New Line Cinema, The Safran Company, Seven Bucks Productions, DC Films",287947,TRUE
26,Dumbo,Dumbo,812000,353284621,1600000,114766307,32.5,238518314,67.5,2019,"Family, Fantasy, Adventure",6.608/10,4315,en,"Australia, Canada, United Kingdom, United States of America","Ben Sharpsteen, Jack Kinney, Bill Roberts, Wilfred Jackson, Samuel Armstrong, Norman Ferguson",Walt Disney Productions,11360,TRUE
27,John Wick: Chapter 3 - Parabellum,John Wick: Chapter 3 - Parabellum,55000000,327777335,326709727,171015687,52.2,156761648,47.8,2019,"Action, Thriller, Crime",7.446/10,10663,en,United States of America,Chad Stahelski,"Thunder Road, Lionsgate, 87Eleven",458156,TRUE
28,Crazy Alien,Crazy Alien,0,327598891,0,0,0,327598891,100,2019,"Comedy, Science Fiction",6.1/10,62,zh,China,Ning Hao,Huanxi Media Group,574037,TRUE
29,Knives Out,Knives Out,40000000,312897920,312897920,165363234,52.8,147534686,47.2,2019,"Comedy, Crime, Mystery",7.846/10,12448,en,United States of America,Rian Johnson,"Lionsgate, MRC, T-Street",546554,TRUE
30,Terminator: Dark Fate,Terminator: Dark Fate,185000000,261119292,261119292,62253077,23.8,198866215,76.2,2019,"Science Fiction, Action, Adventure",6.428/10,5128,en,"China, Hungary, Spain, United States of America",Tim Miller,"20th Century Fox, Skydance Media, Paramount Pictures, Tencent Pictures, TSG Entertainment, Lightstorm Entertainment, Iberdrola, Mid Atlantic Films",290859,TRUE
31,Parasite,Parasite,800000,258129037,7000000,53369749,20.7,204759288,79.3,2019,"Comedy, Thriller, Drama",8.5/10,18428,ko,South Korea,Charles Band,,48311,TRUE
32,Us,Us,20000000,256022707,256067149,175084580,68.4,80938127,31.6,2019,"Horror, Thriller",6.968/10,7344,en,United States of America,Jordan Peele,"Monkeypaw Productions, Universal Pictures, Perfect World Pictures, Blumhouse Productions, QC Entertainment",458723,TRUE
33,Pegasus,Pegasus,0,255863112,0,0,0,255863112,100,2019,"Comedy, Action",6.5/10,79,zh,China,Raoul Servais,"Absolon Films, Pen-Film",45721,TRUE
34,Men in Black: International,Men in Black: International,110000000,253890701,253890701,80001807,31.5,173888894,68.5,2019,"Comedy, Science Fiction, Action",5.911/10,4909,en,"China, United States of America",F. Gary Gray,"Amblin Entertainment, Parkes+MacDonald Image Nation, Columbia Pictures, Tencent Pictures",479455,TRUE
35,X-Men: Dark Phoenix,Dark Phoenix,200000000,252442974,252442974,65845974,26.1,186597000,73.9,2019,"Science Fiction, Action, Adventure",5.98/10,6539,en,United States of America,Simon Kinberg,"Genre Films, Hutch Parker Entertainment, 20th Century Fox, TSG Entertainment, Marvel Entertainment",320288,FALSE
36,Glass,Glass,20000000,246999039,246999039,111048468,45,135950571,55,2019,"Thriller, Drama, Science Fiction",6.674/10,8487,en,United States of America,M. Night Shyamalan,"Blinding Edge Pictures, Blumhouse Productions, Perfect World Pictures",450465,TRUE
37,The Bravest,The Bravest,0,245179562,245179562,290217,0.1,244889345,99.9,2019,"Drama, Action",7.2/10,77,zh,"China, Hong Kong, United States of America",Tony Chan,"Bona Film Group, Alibaba Pictures Group, Columbia Pictures, Sony Pictures International Productions, Wanda Pictures, Huaxia Film Distribution, Basic Pictures, CP Film Production Asia",605375,TRUE
38,Annabelle Comes Home,Annabelle Comes Home,27000000,231252591,231252591,74152591,32.1,157100000,67.9,2019,Horror,6.4/10,3518,en,United States of America,Gary Dauberman,"Atomic Monster, The Safran Company, New Line Cinema",521029,TRUE
39,Better Days,Better Days,0,227313644,225879065,1921657,0.8,225391987,99.2,2019,"Drama, Romance, Thriller, Crime",8.1/10,452,zh,"China, Hong Kong, United Kingdom",Derek Tsang Kwok-Cheung,"Shooting Pictures, China Wit Media, Tianijn Xiron Entertainment, We Pictures, Haojiahuo Pictures, He Nan Dian Ying Dian Shi Zhi Zuo Ji Tuan, Fat Kids Production, Dadi Film Group, Alibaba Pictures Group, Lian Ray Pictures, Henan Film & TV Production Group, China Film Co-Production Corp.",575813,TRUE
40,Ford v Ferrari,Ford v Ferrari,97600000,225508210,225508210,117624357,52.2,107883853,47.8,2019,"Drama, Action, History",8.007/10,8009,en,United States of America,James Mangold,"20th Century Fox, TSG Entertainment, Chernin Entertainment, Turnpike Films",359724,TRUE
41,Little Women,Little Women,18000000,220102318,50083616,108101214,49.1,112001104,50.9,2019,"Drama, Romance, History",7.877/10,6276,en,United States of America,Gillian Armstrong,Di Novi Pictures,9587,TRUE
42,The Addams Family,The Addams Family,30000000,203044905,191502426,100044905,49.3,103000000,50.7,2019,"Family, Animation, Comedy, Fantasy",6.61/10,2337,en,"Canada, United States of America",Barry Sonnenfeld,"Paramount Pictures, Scott Rudin Productions",2907,TRUE
43,Rocketman,RocketMan,16000000,195320400,0,96368160,49.3,98952240,50.7,2019,"Music, Drama",7.325/10,4648,en,"United Kingdom, United States of America",Stuart Gillard,"Walt Disney Pictures, Caravan Pictures",36797,TRUE
44,Downton Abbey,Downton Abbey,20000000,194694725,194694725,96853865,49.7,97840860,50.3,2019,"Drama, Romance, History",7.1/10,1124,en,"United Kingdom, United States of America",Michael Engler,"Focus Features, Carnival Films, Perfect World Pictures",535544,TRUE
45,Weathering with You,Weathering with You,0,192495409,186965409,8056636,4.2,184438773,95.8,2019,"Animation, Drama, Fantasy, Romance",7.999/10,2303,ja,Japan,Makoto Shinkai,"CoMix Wave Films, Story, TOHO, KADOKAWA, jeki, Lawson Entertainment, ""Weathering With You"" Film Partners",568160,TRUE
46,The Lego Movie 2: The Second Part,The Lego Movie 2: The Second Part,99000000,192306508,199603202,105806508,55,86500000,45,2019,"Action, Adventure, Animation, Comedy, Family",6.677/10,2209,en,"Canada, Denmark, United States of America",Mike Mitchell,"Vertigo Entertainment, Warner Animation Group, Lord Miller, Rideback, LEGO, Animal Logic",280217,TRUE
47,Sheep Without a Shepherd,Sheep Without a Shepherd,0,191602146,0,0,0,191602146,100,2019,"Crime, Drama",7.7/10,83,zh,China,Boon-lip Quah,"China Film Group Corporation, Perfect Sky Pictures, Hengye Pictures, As One Production",652783,TRUE
48,The White Storm 2: Drug Lords,The White Storm 2: Drug Lords,25000000,189396380,0,609461,0.3,188786919,99.7,2019,"Drama, Action, Thriller",6.4/10,51,cn,"China, Hong Kong",Herman Yau,"Universe Entertainment, Focus Films Limited, Guangdong Sublime Media, Sun Entertainment Culture, Sil-Metropole Organisation",512731,TRUE
49,Abominable,Abominable,75000000,188623517,190304772,60716390,32.2,127907127,67.8,2019,"Family, Animation, Adventure, Comedy",7.5/10,2046,en,"China, Japan, United States of America",Jill Culton,"DreamWorks Animation, dentsu, Pearl Studio, Zhong Ming You Ying Film, Universal Pictures",431580,TRUE
50,Ip Man 4: The Finale,Ip Man 4: The Finale,52000000,176345966,239000000,3956031,2.2,172389935,97.8,2019,"Action, History, Drama",7.3/10,1953,cn,"China, Hong Kong",Wilson Yip,"Mandarin Films, Tin Tin Film Production",449924,TRUE
51,Gemini Man,Gemini Man,140000000,173469516,173469516,48546770,28,124922746,72,2019,"Science Fiction, Action, Adventure, Thriller",6.3/10,5117,en,"China, United States of America",Ang Lee,"Skydance Media, Jerry Bruckheimer Films, Fosun Pictures, Paramount Pictures, Alibaba Pictures Group",453405,TRUE
52,Spies in Disguise,Spies in Disguise,100000000,171616764,171616764,66757013,38.9,104859751,61.1,2019,"Animation, Action, Adventure, Comedy, Family",7.6/10,2798,en,United States of America,"Nick Bruno, Troy Quane","Chernin Entertainment, Blue Sky Studios, 20th Century Fox Animation, 20th Century Fox",431693,TRUE
53,Hustlers,Hustlers,20000000,157563598,157563598,104963598,66.6,52600000,33.4,2019,"Drama, Comedy, Crime",6.5/10,2919,en,United States of America,Lorene Scafaria,"STXfilms, Gloria Sanchez Productions, Nuyorican Productions",540901,TRUE
54,The Climbers,The Climbers,0,156892866,0,487157,0.3,156405709,99.7,2019,"Adventure, Action, Drama, History",6.5/10,49,zh,China,Paul L. Stein,Warner Bros. Pictures,595394,TRUE
55,Escape Room,Escape Room,0,155712077,1870824,57005601,36.6,98706476,63.4,2019,"Horror, Thriller, Mystery",6.5/10,4668,en,United States of America,Will Wernick,Universum Film,449664,TRUE
56,Yesterday,Yesterday,26000000,154608856,154608856,73286650,47.4,81322206,52.6,2019,"Comedy, Fantasy, Music, Romance",6.698/10,3920,en,"United Kingdom, United States of America",Danny Boyle,"Working Title Films, Working Title Films",515195,TRUE
57,The Angry Birds Movie 2,The Angry Birds Movie 2,65000000,147792047,137792047,41667116,28.2,106124931,71.8,2019,"Animation, Action, Fantasy, Adventure, Comedy",7.1/10,1704,en,"Finland, United States of America",Thurop Van Orman,"Rovio Animation, Columbia Pictures, Sony Pictures Animation, Rovio Entertainment",454640,TRUE
58,Angel Has Fallen,Angel Has Fallen,40000000,146661977,146661977,69030436,47.1,77631541,52.9,2019,"Action, Thriller",6.587/10,3493,en,United States of America,Ric Roman Waugh,"Campbell Grobman Films, Eclectic Pictures, G-BASE, Millennium Media",423204,TRUE
59,Ad Astra,Ad Astra,87500000,127461872,127461872,50188370,39.4,77273502,60.6,2019,"Science Fiction, Drama",6.11/10,6608,en,"Brazil, China, United States of America",James Gray,"New Regency Productions, MadRiver Pictures, Plan B Entertainment, RT Features, Bona Film Group, TSG Entertainment, Keep Your Head Productions, 20th Century Fox",419704,TRUE
60,Midway,Midway,100000000,127390389,127400000,56846802,44.6,70543587,55.4,2019,"Action, War, History",7.139/10,2478,en,"Canada, Hong Kong, United States of America",Roland Emmerich,"AGC Studios, Centropolis Entertainment, Street Entertainment, Entertainment One, Starlight Culture Entertainment Group, Shanghai RuYi Entertainment",522162,TRUE
61,The Upside,The Upside,37500000,125852517,125000000,108252517,86,17600000,14,2019,"Comedy, Drama",7.152/10,1275,en,United States of America,Neil Burger,Escape Artists,440472,TRUE
62,Last Christmas,Last Christmas,30000000,123446172,121600000,35150750,28.5,88295422,71.5,2019,"Comedy, Romance",7.232/10,2401,en,"United Kingdom, United States of America",Paul Feig,"Universal Pictures, Feigco Entertainment",549053,TRUE
63,The Curse of La Llorona,The Curse of La Llorona,9000000,123233739,123233739,54733739,44.4,68500000,55.6,2019,Horror,5.7/10,2434,en,United States of America,Michael Chaves,"Atomic Monster, New Line Cinema, Emile Gladstone Productions",480414,TRUE
64,Looking Up,Looking Up,0,122994583,0,84267,0,122910316,99.9,2019,"Family, Drama",5.4/10,17,zh,China,"Yu Baimei, Deng Chao",,603765,TRUE
65,Zombieland: Double Tap,Zombieland: Double Tap,42000000,122810399,122800000,73123082,59.5,49687317,40.5,2019,"Comedy, Horror",6.9/10,5709,en,United States of America,Ruben Fleischer,"Pariah, Columbia Pictures, 2.0 Entertainment",338967,TRUE
66,Dora and the Lost City of Gold,Dora and the Lost City of Gold,49000000,120597108,120600000,60477943,50.1,60119165,49.9,2019,"Adventure, Comedy, Family, Fantasy",6.6/10,1713,en,"Australia, United States of America",James Bobin,"Nickelodeon Movies, Paramount Players, Walden Media, Screen Queensland, Paramount Pictures, MRC",499701,TRUE
67,Extreme Job,Extreme Job,8120000,119932733,124652206,1565885,1.3,118366848,98.7,2019,"Action, Comedy, Crime",7.097/10,283,ko,South Korea,Lee Byeong-heon,"CJ Entertainment, about Film, Haegrimm Pictures",567646,TRUE
68,Wonder Park,Wonder Park,100000000,119559110,119559110,45216793,37.8,74342317,62.2,2019,"Comedy, Animation, Adventure, Family, Fantasy",6.5/10,694,en,"Spain, United States of America",Dylan Brown,"Nickelodeon Movies, Paramount Animation, Ilion Animation Studios, Paramount Pictures",400157,TRUE
69,P Storm,P Storm,0,117991727,0,326711,0.3,117665016,99.7,2019,"Action, Crime",6.4/10,61,cn,Hong Kong,David Lam Tak-Luk,Mandarin Motion Pictures,588073,TRUE
70,Detective Conan: The Fist of Blue Sapphire,Case Closed: The Fist of Blue Sapphire,0,115448200,115448200,0,0,115448200,100,2019,"Animation, Mystery, Crime, Action, Adventure",6.2/10,156,ja,Japan,Chika Nagaoka,"TMS Entertainment, Shogakukan, Yomiuri Telecasting Corporation, Nippon Television Network Corporation, Shogakukan-Shueisha Productions, TOHO",566555,FALSE
71,The Gentlemen,The Gentlemen,22000000,115171795,115171795,36471795,31.7,78700000,68.3,2019,"Action, Crime, Comedy",7.7/10,5857,en,"United Kingdom, United States of America",Guy Ritchie,"Miramax, Toff Guy Films, Coach Films, STXfilms",522627,TRUE
72,Pet Sematary,Pet Sematary,21000000,113118226,113118226,54724696,48.4,58393530,51.6,2019,"Horror, Thriller",5.738/10,3206,en,United States of America,"Dennis Widmyer, Kevin Kölsch","di Bonaventura Pictures, Paramount Pictures",157433,TRUE
73,Boonie Bears: Blast Into the Past,Boonie Bears: Blast into the Past,0,112367881,112369259,0,0,112367881,100,2019,"Animation, Family, Adventure, Fantasy",7.0/10,23,zh,China,"Ding Liang, Huida Lin",Fantawild Animation,581218,TRUE
74,Good Boys,Good Boys,20000000,111173598,111037232,83140306,74.8,28033292,25.2,2019,Comedy,6.8/10,1835,en,United States of America,Gene Stupnitsky,"Good Universe, Point Grey Pictures",521777,TRUE
75,Scary Stories to Tell in the Dark,Scary Stories to Tell in the Dark,25000000,104545505,104545505,68947075,65.9,35598430,34.1,2019,"Horror, Thriller",6.5/10,2642,en,"Canada, Hong Kong, United States of America",André Øvredal,"1212 Entertainment, Double Dare You, Entertainment One, CBS Films, Rolling Hills, Hivemind, Starlight Culture Entertainment Group",417384,TRUE
76,Line Walker 2: Invisible Spy,Line Walker 2: Invisible Spy,0,99482027,0,296751,0.3,99185276,99.7,2019,"Action, Crime, Thriller, Drama",6.9/10,52,cn,"China, Hong Kong",Jazz Boon,"Babieka Films, Shaw Brothers, One Cool Pictures, J.Q. Pictures, TVB, Big Honor Entertainment, Pegasus Motion Pictures, Alibaba Pictures Group, Tencent Pictures",589157,TRUE
77,The Hustle,The Hustle,21000000,97409779,97400000,35417038,36.4,61992741,63.6,2019,"Comedy, Crime",6.181/10,2490,en,"Spain, United States of America",Chris Addison,"Pin High, Metro-Goldwyn-Mayer, Cave 76 Productions, Camp Sugar, Palma Pictures",449562,TRUE
78,The New King of Comedy,The New King of Comedy,8000000,95618308,106618508,0,0,95618308,100,2019,Comedy,5.8/10,31,zh,China,Stephen Chow,Star Overseas,575138,TRUE
79,Adoring,Adoring,0,94975692,0,0,0,94975692,100,2019,"Drama, Family",7.0/10,8,zh,China,Larry Yang,"海润影视制作有限公司, Joy Leader",626616,TRUE
80,Five Feet Apart,Five Feet Apart,7000000,92554209,92600000,45729221,49.4,46824988,50.6,2019,"Romance, Drama",8.245/10,5625,en,United States of America,Justin Baldoni,"Wayfarer Entertainment, CBS Films",527641,TRUE
81,Crawl,Crawl,13500000,91542097,91500000,39014193,42.6,52527904,57.4,2019,"Horror, Thriller",6.3/10,3097,en,"Canada, Serbia, United States of America",Alexandre Aja,"Raimi Productions, Fire Axe Pictures, Serbia Creates Film, Paramount Pictures",511987,TRUE
82,Rambo: Last Blood,Rambo: Last Blood,50000000,91490353,91500000,44819352,49,46671001,51,2019,"Action, Thriller, Drama",6.542/10,3894,en,"China, United States of America",Adrian Grünberg,"Millennium Media, Templeton Media, Campbell Grobman Films, Dadi Film Group, Balboa Productions",522938,TRUE
83,Jojo Rabbit,Jojo Rabbit,14000000,90335025,82468705,33370906,36.9,56964119,63.1,2019,"Comedy, War, Drama",8.0/10,9564,en,"New Zealand, United States of America",Taika Waititi,"Fox Searchlight Pictures, Defender Films, Piki Films",515001,TRUE
84,Serial (Bad) Weddings 2,Serial (Bad) Weddings 2,18500000,87761988,87761988,0,0,87761988,100,2019,Comedy,5.89/10,1257,fr,France,Philippe de Chauveron,"Les Films du 24, TF1 Films Production, Les Films du Premier",505436,TRUE
85,One Piece: Stampede,One Piece: Stampede,0,81562741,81562741,1298528,1.6,80264213,98.4,2019,"Animation, Action, Adventure, Fantasy",7.807/10,593,ja,Japan,Takashi Otsuka,"Toei Animation, Toei Company",568012,TRUE
86,A Dog's Way Home,A Dog's Way Home,18000000,80708134,17643857,42004346,52,38703788,48,2019,"Drama, Adventure, Family",7.4/10,1105,en,"China, United States of America",Charles Martin Smith,"Bona Film Group, Pariah, Columbia Pictures",508763,TRUE
87,A Dog's Journey,A Dog's Journey,16000000,78870908,78871079,22782371,28.9,56088537,71.1,2019,"Family, Adventure, Drama",8.072/10,1503,en,"Canada, China, India, United States of America",Gail Mancuso,"Amblin Entertainment, Reliance Entertainment, Walden Media, Alibaba Pictures Group, Pariah, DreamWorks Pictures, Amblin Partners",522518,TRUE
88,Cold Pursuit,Cold Pursuit,60000000,76419755,76419755,32138862,42.1,44280893,57.9,2019,"Action, Crime, Thriller, Comedy",5.828/10,2583,en,"Canada, France, Norway, United Kingdom, United States of America",Hans Petter Moland,"StudioCanal, Paradox Produksjon, MAS Productions, Summit Entertainment, Disappearance, Canal+, Ciné+",438650,TRUE
89,Cats,Cats,95000000,75558925,77276321,27166770,36,48392155,64,2019,"Fantasy, Comedy, Drama",4.1/10,968,en,"China, United Kingdom, United States of America",Tom Hooper,"Universal Pictures, Perfect World Pictures, Working Title Films, Amblin Entertainment, Monumental Pictures, The Really Useful Group",536869,TRUE
90,A Madea Family Funeral,A Madea Family Funeral,20000000,74747725,74747725,73257045,98,1490680,2,2019,Comedy,5.9/10,480,en,United States of America,Tyler Perry,Tyler Perry Studios,464504,TRUE
91,Charlie's Angels,Charlie's Angels,92000000,73279888,264105545,17803077,24.3,55476811,75.7,2019,"Action, Adventure, Comedy",6.4/10,2965,en,United States of America,McG,"Columbia Pictures, Tall Trees Productions, Flower Films, Leonard Goldberg Productions",4327,TRUE
92,Doctor Sleep,Doctor Sleep,0,72381712,0,31581712,43.6,40800000,56.4,2019,"Horror, Thriller, Fantasy",7.145/10,4435,en,United States of America,Nick Willing,"British Screen, Kismet Film Company, BBC Film, The Film Consortium",20321,TRUE
93,What Men Want,What Men Want,20000000,72216294,69766483,54611903,75.6,17604391,24.4,2019,"Comedy, Romance",6.2/10,1449,en,United States of America,Adam Shankman,"BET Films, Paramount Players, Paramount Pictures, Will Packer Productions",487297,TRUE
94,Exit,Exit,0,69501772,0,470699,0.7,69031073,99.3,2019,"Action, Comedy",7.6/10,247,ko,South Korea,"Lars Ohlson, Martti Ekstrand, Stig Bergqvist, Jonas Odell","Filmtecknarna, Svenska Filminstitutet",353127,TRUE
95,After,After,14000000,69497587,69497587,12138565,17.5,57359022,82.5,2019,"Romance, Drama",7.122/10,8232,en,United States of America,Jenny Gage,"CalMaple Films, Wattpad, Offspring Entertainment, Diamond Film Productions, Voltage Pictures, Frayed Pages Entertainment",537915,TRUE
96,Playing with Fire,Playing with Fire,29900000,69412425,69412425,44451847,64,24960578,36,2019,"Family, Comedy",6.6/10,690,en,United States of America,Andy Fickman,"Broken Road Productions, Nickelodeon Movies, Paramount Players, Walden Media, Paramount Pictures",554241,TRUE
97,A Beautiful Day in the Neighborhood,A Beautiful Day in the Neighborhood,25000000,67925733,67900000,61704055,90.8,6221678,9.2,2019,"Drama, History",6.972/10,1609,en,"China, United States of America",Marielle Heller,"TriStar Pictures, Tencent Pictures, Big Beach",501907,TRUE
98,War,War,25000000,67179155,40452643,4654000,6.9,62525155,93.1,2019,"Action, Thriller, Adventure",6.765/10,327,hi,India,Philip G. Atwell,"Lionsgate, Mosaic Media Group, Fierce Entertainment, Current Entertainment, Rogue Films",10431,TRUE
99,Doraemon: Nobita's Chronicle of the Moon Exploration,Doraemon: Nobita's Chronicle of the Moon Exploration,0,65406606,65406606,0,0,65406606,100,2019,"Animation, Adventure, Comedy, Science Fiction, Fantasy, Family",7.6/10,57,ja,Japan,Shinnosuke Yakuwa,"Fujiko Productions, Shin-Ei Animation, Asatsu-DK, TV Asahi, Shogakukan, Shogakukan-Shueisha Productions",575222,TRUE
100,Happy Death Day 2U,Happy Death Day 2U,9000000,64600152,64600152,28148130,43.6,36452022,56.4,2019,"Comedy, Horror, Science Fiction",6.308/10,3377,en,United States of America,Christopher Landon,"Digital Riot Media, Blumhouse Productions, Universal Pictures",512196,TRUE
101,White Snake,White Snake: Afloat,0,62098770,59307515,34730,0,62064040,99.9,2019,"Romance, Animation, Fantasy",7.7/10,473,zh,China,"Chen Jianxi, Li Jiakai",Light Chaser Animation Studios,1207123,FALSE
102,Bombshell,Bombshell,32000000,61404394,61404394,31762808,51.7,29641586,48.3,2019,Drama,6.8/10,2974,en,"Canada, United States of America",Jay Roach,"Lighthouse Management + Media, Denver & Delilah Productions, Bron Studios, Annapurna Pictures, Creative Wealth Media Finance, Lionsgate, Endeavor Content",525661,TRUE
103,Ashfall,Ashfall,17700000,61354854,61321941,372562,0.6,60982292,99.4,2019,"Action, Adventure, Thriller",6.8/10,573,ko,South Korea,"Kim Byung-seo, Lee Hae-jun","Dexter Studios, CJ Entertainment, Perfect Storm Film, Dexter Pictures",581387,TRUE
104,Ma,Ma,5000000,61220784,51749995,45896028,75,15324756,25,2019,"Horror, Thriller",5.8/10,2180,en,"Japan, United States of America",Tate Taylor,"Blumhouse Productions, Wyolah Films, dentsu, Fuji Television Network",502416,TRUE
105,My Best Summer,The Best Summer of My Life,0,60011073,0,0,0,60011073,100,2019,"Romance, Drama",5.3/10,11,zh,China,Dani de la Orden,"Atresmedia, A Contracorriente Films, Álamo Producciones Audiovisuales",519597,FALSE
