Rank,Release Group,$Worldwide,$Domestic,Domestic %,$Foreign,Foreign %,Year,Genres,Rating,Vote_Count,Original_Language,Production_Countries,Budget,TMDB Revenue,Directors,Production Companies,Id,Name
184,Champions,25962612.0,0.0,0.0,25962612.0,100.0,2018,"Comedy, Family, Drama",7.52/10,734.0,es,Spain,0.0,9263009.0,Bobby Farrelly,"Gold Circle Films, Focus Features",933419,Champions
185,White Boy Rick,25957482.0,24011188.0,92.5,1946294.0,7.5,2018,"Crime, Drama",6.3/10,1074.0,en,United States of America,29000000.0,26000000.0,Yann Demange,"Studio 8, Protozoa Pictures, LBI Productions, Columbia Pictures, Le Grisbi Productions",438808,White Boy Rick
186,"Paul, Apostle of Christ",25915966.0,17560475.0,67.8,8355491.0,32.2,2018,Drama,7.6/10,357.0,en,United States of America,5000000.0,25915966.0,Andrew Hyatt,"Outside Da Box, Affirm Films, ODB Films",476968,"Paul, Apostle of Christ"
187,Keys to the Heart,25375866.0,75134.0,0.3,25300732.0,99.7,2018,"Drama, Comedy",7.9/10,35.0,ko,South Korea,0.0,0.0,Kerwin Go,"Reality MM Studios, Viva Films",778277,Keys to the Heart
188,Stan & Ollie,24420923.0,5470235.0,22.4,18950688.0,77.6,2018,"Comedy, Drama",6.969/10,1037.0,en,"Canada, United Kingdom, United States of America",7500000.0,8742330.0,Rob Schneider,"Crystal Sky Pictures, From Out of Nowhere Productions, Silver Nitrate, Chicago Entertainment Partners",13161,Big Stan
189,The Witch: Part 1 - The Subversion,24340302.0,0.0,0.0,24340302.0,100.0,2018,"Action, Mystery, Science Fiction",7.8/10,560.0,ko,"Hong Kong, South Korea",5500000.0,24340302.0,Park Hoon-jung,"Peppermint & Company, Warner Bros. Korea, Goldmoon Film, Finecut, Huayi Tencent Entertainment, Union Investment Partners",530254,The Witch: Part 1. The Subversion
190,The Accidental Detective 2: In Action,24243825.0,179045.0,0.7,24064780.0,99.3,2018,"Comedy, Crime",6.5/10,32.0,ko,South Korea,0.0,24243825.0,E.oni,"CJ Entertainment, Cree Pictures",522811,The Accidental Detective 2: In Action
191,Killing for the Prosecution,23929620.0,0.0,0.0,23929620.0,100.0,2018,"Mystery, Drama, Crime, Thriller",6.075/10,20.0,ja,Japan,0.0,0.0,Masato Harada,"TOHO, J Storm, Toho Pictures",517373,Killing for the Prosecution
192,Pokémon the Movie: The Power of Us,23740788.0,789170.0,3.3,22951618.0,96.7,2018,"Animation, Family, Adventure, Fantasy",7.1/10,197.0,ja,Japan,0.0,23740788.0,Tetsuo Yajima,"OLM, Pikachu Project, TV Tokyo, The Pokémon Company, WIT STUDIO, Shogakukan, TakaraTomy, jeki, TOHO, Shogakukan-Shueisha Productions",494407,Pokémon the Movie: The Power of Us
193,The Guernsey Literary and Potato Peel Pie Society,23148937.0,0.0,0.0,23148937.0,100.0,2018,"Romance, Drama, History",7.435/10,1314.0,en,"United Kingdom, United States of America, France",0.0,23148937.0,Mike Newell,"Blueprint Pictures, The Mazur Kaplan Company, StudioCanal",451480,The Guernsey Literary & Potato Peel Pie Society
194,The Crimes That Bind,23144130.0,0.0,0.0,23144130.0,100.0,2018,"Mystery, Thriller, Crime",7.1/10,39.0,ja,Japan,0.0,0.0,Sebastián Schindel,"Buffalo Films, Magoya Films",632618,The Crimes That Bind
195,New Happy Dad and Son 3: Adventure in Russia,23130469.0,0.0,0.0,23130469.0,100.0,2018,Animation,6.0/10,1.0,zh,,0.0,0.0,He Cheng,,553233,New Happy Dad and Son 3: Adventure in Russia
196,Padmaavat,22991060.0,11846060.0,51.5,11145000.0,48.5,2018,"Drama, History, Romance",6.933/10,270.0,hi,India,31000000.0,81673897.0,Sanjay Leela Bhansali,"Bhansali Productions, Viacom18 Studios",432527,Padmaavat
197,Won't You Be My Neighbor?,22844741.0,22835787.0,100.0,8954.0,0.0,2018,Documentary,8.0/10,542.0,en,United States of America,0.0,22835787.0,Morgan Neville,"Tremolo Productions, Impact Partners, Independent Lens, PBS",490003,Won't You Be My Neighbor?
198,Europe Raiders,22435156.0,0.0,0.0,22435156.0,100.0,2018,"Action, Adventure, Thriller",7.2/10,49.0,cn,"China, Hong Kong, Italy",0.0,0.0,Jingle Ma Choh-Sing,"Mei Ah Entertainment, Lotus Production, Panorama Films, Inlook Media Group, Jet Tone Production",420644,Europe Raiders
199,Mojin: The Worm Valley,22381583.0,101516.0,0.5,22280067.0,99.5,2018,"Action, Fantasy, Adventure",6.2/10,50.0,zh,China,0.0,22381583.0,Xing Fei,,571446,Mojin: The Worm Valley
200,Stree,22075730.0,0.0,0.0,22075730.0,100.0,2018,"Horror, Comedy",6.905/10,152.0,hi,India,0.0,0.0,,,767586,Stree
1,Avengers: Endgame,2799439100.0,858373000.0,30.7,1941066100.0,69.3,2019,"Adventure, Science Fiction, Action",8.246/10,25780.0,en,United States of America,356000000.0,2799439100.0,"Joe Russo, Anthony Russo",Marvel Studios,299534,Avengers: Endgame
2,The Lion King,1656943394.0,543638043.0,32.8,1113305351.0,67.2,2019,"Adventure, Drama, Family, Animation",7.116/10,10058.0,en,United States of America,260000000.0,1662020819.0,Jon Favreau,"Walt Disney Pictures, Fairview Entertainment",420818,The Lion King
3,Frozen II,1450026933.0,477373578.0,32.9,972653355.0,67.1,2019,"Family, Animation, Adventure, Comedy, Fantasy",7.255/10,9751.0,en,United States of America,150000000.0,1453683476.0,"Jennifer Lee, Chris Buck","Walt Disney Pictures, Walt Disney Animation Studios",330457,Frozen II
4,Spider-Man: Far from Home,1131927996.0,390532085.0,34.5,741395911.0,65.5,2019,"Action, Adventure, Science Fiction",7.42/10,15754.0,en,United States of America,160000000.0,1131927996.0,Jon Watts,"Marvel Studios, Pascal Pictures, Columbia Pictures",429617,Spider-Man: Far From Home
5,Captain Marvel,1128274794.0,426829839.0,37.8,701444955.0,62.2,2019,"Action, Adventure, Science Fiction",6.812/10,15741.0,en,United States of America,152000000.0,1131416446.0,"Ryan Fleck, Anna Boden",Marvel Studios,299537,Captain Marvel
6,Joker,1078751311.0,335451311.0,31.1,743300000.0,68.9,2019,"Crime, Thriller, Drama",8.144/10,25889.0,en,"Canada, United States of America",55000000.0,1078958629.0,Todd Phillips,"Warner Bros. Pictures, Joint Effort, Village Roadshow Pictures, Bron Studios, DC Films",475557,Joker
7,Star Wars: Episode IX - The Rise of Skywalker,1074144248.0,515202542.0,48.0,558941706.0,52.0,2019,"Adventure, Action, Science Fiction",6.3/10,9940.0,en,United States of America,416000000.0,1074144248.0,J.J. Abrams,"Lucasfilm Ltd., Bad Robot",181812,Star Wars: The Rise of Skywalker
8,Toy Story 4,1073394593.0,434038008.0,40.4,639356585.0,59.6,2019,"Family, Adventure, Animation, Comedy, Fantasy",7.5/10,9802.0,en,United States of America,175000000.0,1073841394.0,Josh Cooley,"Walt Disney Pictures, Pixar",301528,Toy Story 4
9,Aladdin,1050693953.0,355559216.0,33.8,695134737.0,66.2,2019,"Adventure, Fantasy, Romance, Family",7.098/10,10058.0,en,United States of America,183000000.0,1054300000.0,Guy Ritchie,"Walt Disney Pictures, Rideback",420817,Aladdin
10,Jumanji: The Next Level,801693929.0,320314960.0,40.0,481378969.0,60.0,2019,"Adventure, Comedy, Fantasy",6.9/10,8670.0,en,United States of America,125000000.0,801693929.0,Jake Kasdan,"Columbia Pictures, Seven Bucks Productions, Matt Tolmach Productions, The Detective Agency",512200,Jumanji: The Next Level
11,Fast & Furious Presents: Hobbs & Shaw,760732926.0,173956935.0,22.9,586775991.0,77.1,2019,"Action, Adventure, Comedy",6.861/10,7207.0,en,United States of America,340000000.0,704709660.0,Louis Leterrier,"Universal Pictures, Original Film, One Race, Perfect Storm Entertainment",385687,Fast X
12,Ne Zha,726024868.0,3695533.0,0.5,722329335.0,99.5,2019,"Animation, Fantasy, Adventure",7.9/10,402.0,zh,China,80000000.0,2114000000.0,Yang Yu,"Chengdu Coco Cartoon, Beijing Enlight Pictures, Chengdu Enlight Animation, Coloroom Pictures",980477,Ne Zha 2
13,The Wandering Earth,699856699.0,5971413.0,0.9,693885286.0,99.1,2019,"Science Fiction, Action, Drama",6.616/10,968.0,zh,China,48000000.0,0.0,Frant Gwo,"China Film Group Corporation, Beijing Jingxi Culture, DF Pictures, G!Film Studio, Free Whale Pictures",535167,The Wandering Earth
14,How to Train Your Dragon: The Hidden World,521799505.0,160799505.0,30.8,361000000.0,69.2,2019,"Animation, Family, Adventure",7.751/10,6425.0,en,United States of America,129000000.0,524580592.0,Dean DeBlois,"DreamWorks Animation, Mad Hatter Entertainment",166428,How to Train Your Dragon: The Hidden World
15,Maleficent: Mistress of Evil,491730089.0,113929605.0,23.2,377800484.0,76.8,2019,"Family, Fantasy, Adventure, Action",7.303/10,6107.0,en,United States of America,185000000.0,491730089.0,Joachim Rønning,"Walt Disney Pictures, Roth Films",420809,Maleficent: Mistress of Evil
16,It Chapter Two,473093228.0,211593228.0,44.7,261500000.0,55.3,2019,"Horror, Drama, Thriller",6.842/10,8761.0,en,United States of America,79000000.0,473123154.0,Andy Muschietti,"New Line Cinema, Vertigo Entertainment, Double Dream, Rideback",474350,It Chapter Two
17,"My People, My Country",450064993.0,2356683.0,0.5,447708310.0,99.5,2019,"Drama, History",6.8/10,62.0,zh,"China, Hong Kong",0.0,450064993.0,"Chen Kaige, Zhang Yibai, Guan Hu, Xiaolu Xue, Xu Zheng, Ning Hao, Wen Muye","Huaxia Film Distribution, Bona Film Group, Alibaba Pictures Group, Emperor Film Production, Beijing Enlight Pictures",612845,"My People, My Country"
18,Pokémon: Detective Pikachu,433305346.0,144105346.0,33.3,289200000.0,66.7,2019,"Action, Adventure, Fantasy",6.927/10,6849.0,en,"Japan, United States of America",150000000.0,449762638.0,Rob Letterman,"Legendary Pictures, The Pokémon Company, TOHO",447404,Pokémon Detective Pikachu
19,The Secret Life of Pets 2,431164459.0,158980250.0,36.9,272184209.0,63.1,2019,"Adventure, Animation, Comedy, Family",7.0/10,3038.0,en,United States of America,80000000.0,429434163.0,Chris Renaud,"Universal Pictures, Illumination",412117,The Secret Life of Pets 2
20,The Captain,417863545.0,706572.0,0.2,417156973.0,99.8,2019,"Action, Animation, Comedy, Family",6.225/10,1211.0,en,United States of America,170000000.0,714766572.0,"Joe Russo, Anthony Russo",Marvel Studios,100402,Captain America: The Winter Soldier
21,Alita: Battle Angel,404980543.0,85838210.0,21.2,319142333.0,78.8,2019,"Action, Science Fiction, Adventure",7.241/10,9171.0,en,United States of America,170000000.0,405000000.0,Robert Rodriguez,"Troublemaker Studios, Lightstorm Entertainment, 20th Century Fox, TSG Entertainment",399579,Alita: Battle Angel
22,Godzilla: King of the Monsters,387300138.0,110500138.0,28.5,276800000.0,71.5,2019,"Science Fiction, Action",6.7/10,6184.0,en,"China, Japan, United States of America",170000000.0,387300138.0,Michael Dougherty,"Legendary Pictures, Huahua Media, TOHO",373571,Godzilla: King of the Monsters
23,1917,384580017.0,159227644.0,41.4,225352373.0,58.6,2019,"War, History, Thriller, Drama",8.0/10,12433.0,en,"India, Spain, United Kingdom, United States of America",100000000.0,394638258.0,Sam Mendes,"DreamWorks Pictures, Reliance Entertainment, New Republic Pictures, Neal Street Productions, Mogambo Films, Amblin Partners",530915,1917
24,Once Upon a Time... in Hollywood,377426903.0,142502728.0,37.8,234924175.0,62.2,2019,"Comedy, Drama, Thriller",7.4/10,13492.0,en,"China, United Kingdom, United States of America",95000000.0,392105159.0,Quentin Tarantino,"Heyday Films, Columbia Pictures, Bona Film Group",466272,Once Upon a Time... in Hollywood
25,Shazam!,365971656.0,140371656.0,38.4,225600000.0,61.6,2019,"Action, Comedy, Fantasy",7.001/10,9539.0,en,United States of America,80000000.0,367799011.0,David F. Sandberg,"New Line Cinema, The Safran Company, Seven Bucks Productions, DC Films",287947,Shazam!
26,Dumbo,353284621.0,114766307.0,32.5,238518314.0,67.5,2019,"Family, Fantasy, Adventure",6.608/10,4315.0,en,"Australia, Canada, United Kingdom, United States of America",812000.0,1600000.0,"Ben Sharpsteen, Jack Kinney, Bill Roberts, Wilfred Jackson, Samuel Armstrong, Norman Ferguson",Walt Disney Productions,11360,Dumbo
27,John Wick: Chapter 3 - Parabellum,327777335.0,171015687.0,52.2,156761648.0,47.8,2019,"Action, Thriller, Crime",7.446/10,10663.0,en,United States of America,55000000.0,326709727.0,Chad Stahelski,"Thunder Road, Lionsgate, 87Eleven",458156,John Wick: Chapter 3 - Parabellum
28,Crazy Alien,327598891.0,0.0,0.0,327598891.0,100.0,2019,"Comedy, Science Fiction",6.1/10,62.0,zh,China,0.0,0.0,Ning Hao,Huanxi Media Group,574037,Crazy Alien
29,Knives Out,312897920.0,165363234.0,52.8,147534686.0,47.2,2019,"Comedy, Crime, Mystery",7.846/10,12448.0,en,United States of America,40000000.0,312897920.0,Rian Johnson,"Lionsgate, MRC, T-Street",546554,Knives Out
30,Terminator: Dark Fate,261119292.0,62253077.0,23.8,198866215.0,76.2,2019,"Science Fiction, Action, Adventure",6.428/10,5128.0,en,"China, Hungary, Spain, United States of America",185000000.0,261119292.0,Tim Miller,"20th Century Fox, Skydance Media, Paramount Pictures, Tencent Pictures, TSG Entertainment, Lightstorm Entertainment, Iberdrola, Mid Atlantic Films",290859,Terminator: Dark Fate
31,Parasite,258129037.0,53369749.0,20.7,204759288.0,79.3,2019,"Comedy, Thriller, Drama",8.5/10,18428.0,ko,South Korea,800000.0,7000000.0,Charles Band,,48311,Parasite
32,Us,256022707.0,175084580.0,68.4,80938127.0,31.6,2019,"Horror, Thriller",6.968/10,7344.0,en,United States of America,20000000.0,256067149.0,Jordan Peele,"Monkeypaw Productions, Universal Pictures, Perfect World Pictures, Blumhouse Productions, QC Entertainment",458723,Us
33,Pegasus,255863112.0,0.0,0.0,255863112.0,100.0,2019,"Comedy, Action",6.5/10,79.0,zh,China,0.0,0.0,Raoul Servais,"Absolon Films, Pen-Film",45721,Pegasus
34,Men in Black: International,253890701.0,80001807.0,31.5,173888894.0,68.5,2019,"Comedy, Science Fiction, Action",5.911/10,4909.0,en,"China, United States of America",110000000.0,253890701.0,F. Gary Gray,"Amblin Entertainment, Parkes+MacDonald Image Nation, Columbia Pictures, Tencent Pictures",479455,Men in Black: International
35,X-Men: Dark Phoenix,252442974.0,65845974.0,26.1,186597000.0,73.9,2019,"Science Fiction, Action, Adventure",5.98/10,6539.0,en,United States of America,200000000.0,252442974.0,Simon Kinberg,"Genre Films, Hutch Parker Entertainment, 20th Century Fox, TSG Entertainment, Marvel Entertainment",320288,Dark Phoenix
36,Glass,246999039.0,111048468.0,45.0,135950571.0,55.0,2019,"Thriller, Drama, Science Fiction",6.674/10,8487.0,en,United States of America,20000000.0,246999039.0,M. Night Shyamalan,"Blinding Edge Pictures, Blumhouse Productions, Perfect World Pictures",450465,Glass
37,The Bravest,245179562.0,290217.0,0.1,244889345.0,99.9,2019,"Drama, Action",7.2/10,77.0,zh,"China, Hong Kong, United States of America",0.0,245179562.0,Tony Chan,"Bona Film Group, Alibaba Pictures Group, Columbia Pictures, Sony Pictures International Productions, Wanda Pictures, Huaxia Film Distribution, Basic Pictures, CP Film Production Asia",605375,The Bravest
38,Annabelle Comes Home,231252591.0,74152591.0,32.1,157100000.0,67.9,2019,Horror,6.4/10,3518.0,en,United States of America,27000000.0,231252591.0,Gary Dauberman,"Atomic Monster, The Safran Company, New Line Cinema",521029,Annabelle Comes Home
39,Better Days,227313644.0,1921657.0,0.8,225391987.0,99.2,2019,"Drama, Romance, Thriller, Crime",8.1/10,452.0,zh,"China, Hong Kong, United Kingdom",0.0,225879065.0,Derek Tsang Kwok-Cheung,"Shooting Pictures, China Wit Media, Tianijn Xiron Entertainment, We Pictures, Haojiahuo Pictures, He Nan Dian Ying Dian Shi Zhi Zuo Ji Tuan, Fat Kids Production, Dadi Film Group, Alibaba Pictures Group, Lian Ray Pictures, Henan Film & TV Production Group, China Film Co-Production Corp.",575813,Better Days
40,Ford v Ferrari,225508210.0,117624357.0,52.2,107883853.0,47.8,2019,"Drama, Action, History",8.007/10,8009.0,en,United States of America,97600000.0,225508210.0,James Mangold,"20th Century Fox, TSG Entertainment, Chernin Entertainment, Turnpike Films",359724,Ford v Ferrari
41,Little Women,220102318.0,108101214.0,49.1,112001104.0,50.9,2019,"Drama, Romance, History",7.877/10,6276.0,en,United States of America,18000000.0,50083616.0,Gillian Armstrong,Di Novi Pictures,9587,Little Women
42,The Addams Family,203044905.0,100044905.0,49.3,103000000.0,50.7,2019,"Family, Animation, Comedy, Fantasy",6.61/10,2337.0,en,"Canada, United States of America",30000000.0,191502426.0,Barry Sonnenfeld,"Paramount Pictures, Scott Rudin Productions",2907,The Addams Family
43,Rocketman,195320400.0,96368160.0,49.3,98952240.0,50.7,2019,"Music, Drama",7.325/10,4648.0,en,"United Kingdom, United States of America",16000000.0,0.0,Stuart Gillard,"Walt Disney Pictures, Caravan Pictures",36797,RocketMan
44,Downton Abbey,194694725.0,96853865.0,49.7,97840860.0,50.3,2019,"Drama, Romance, History",7.1/10,1124.0,en,"United Kingdom, United States of America",20000000.0,194694725.0,Michael Engler,"Focus Features, Carnival Films, Perfect World Pictures",535544,Downton Abbey
45,Weathering with You,192495409.0,8056636.0,4.2,184438773.0,95.8,2019,"Animation, Drama, Fantasy, Romance",7.999/10,2303.0,ja,Japan,0.0,186965409.0,Makoto Shinkai,"CoMix Wave Films, Story, TOHO, KADOKAWA, jeki, Lawson Entertainment, ""Weathering With You"" Film Partners",568160,Weathering with You
46,The Lego Movie 2: The Second Part,192306508.0,105806508.0,55.0,86500000.0,45.0,2019,"Action, Adventure, Animation, Comedy, Family",6.677/10,2209.0,en,"Canada, Denmark, United States of America",99000000.0,199603202.0,Mike Mitchell,"Vertigo Entertainment, Warner Animation Group, Lord Miller, Rideback, LEGO, Animal Logic",280217,The Lego Movie 2: The Second Part
47,Sheep Without a Shepherd,191602146.0,0.0,0.0,191602146.0,100.0,2019,"Crime, Drama",7.7/10,83.0,zh,China,0.0,0.0,Boon-lip Quah,"China Film Group Corporation, Perfect Sky Pictures, Hengye Pictures, As One Production",652783,Sheep Without a Shepherd
48,The White Storm 2: Drug Lords,189396380.0,609461.0,0.3,188786919.0,99.7,2019,"Drama, Action, Thriller",6.4/10,51.0,cn,"China, Hong Kong",25000000.0,0.0,Herman Yau,"Universe Entertainment, Focus Films Limited, Guangdong Sublime Media, Sun Entertainment Culture, Sil-Metropole Organisation",512731,The White Storm 2: Drug Lords
49,Abominable,188623517.0,60716390.0,32.2,127907127.0,67.8,2019,"Family, Animation, Adventure, Comedy",7.5/10,2046.0,en,"China, Japan, United States of America",75000000.0,190304772.0,Jill Culton,"DreamWorks Animation, dentsu, Pearl Studio, Zhong Ming You Ying Film, Universal Pictures",431580,Abominable
50,Ip Man 4: The Finale,176345966.0,3956031.0,2.2,172389935.0,97.8,2019,"Action, History, Drama",7.3/10,1953.0,cn,"China, Hong Kong",52000000.0,239000000.0,Wilson Yip,"Mandarin Films, Tin Tin Film Production",449924,Ip Man 4: The Finale
51,Gemini Man,173469516.0,48546770.0,28.0,124922746.0,72.0,2019,"Science Fiction, Action, Adventure, Thriller",6.3/10,5117.0,en,"China, United States of America",140000000.0,173469516.0,Ang Lee,"Skydance Media, Jerry Bruckheimer Films, Fosun Pictures, Paramount Pictures, Alibaba Pictures Group",453405,Gemini Man
52,Spies in Disguise,171616764.0,66757013.0,38.9,104859751.0,61.1,2019,"Animation, Action, Adventure, Comedy, Family",7.6/10,2798.0,en,United States of America,100000000.0,171616764.0,"Nick Bruno, Troy Quane","Chernin Entertainment, Blue Sky Studios, 20th Century Fox Animation, 20th Century Fox",431693,Spies in Disguise
53,Hustlers,157563598.0,104963598.0,66.6,52600000.0,33.4,2019,"Drama, Comedy, Crime",6.5/10,2919.0,en,United States of America,20000000.0,157563598.0,Lorene Scafaria,"STXfilms, Gloria Sanchez Productions, Nuyorican Productions",540901,Hustlers
54,The Climbers,156892866.0,487157.0,0.3,156405709.0,99.7,2019,"Adventure, Action, Drama, History",6.5/10,49.0,zh,China,0.0,0.0,Paul L. Stein,Warner Bros. Pictures,595394,The Climbers
55,Escape Room,155712077.0,57005601.0,36.6,98706476.0,63.4,2019,"Horror, Thriller, Mystery",6.5/10,4668.0,en,United States of America,0.0,1870824.0,Will Wernick,Universum Film,449664,Escape Room
56,Yesterday,154608856.0,73286650.0,47.4,81322206.0,52.6,2019,"Comedy, Fantasy, Music, Romance",6.698/10,3920.0,en,"United Kingdom, United States of America",26000000.0,154608856.0,Danny Boyle,"Working Title Films, Working Title Films",515195,Yesterday
57,The Angry Birds Movie 2,147792047.0,41667116.0,28.2,106124931.0,71.8,2019,"Animation, Action, Fantasy, Adventure, Comedy",7.1/10,1704.0,en,"Finland, United States of America",65000000.0,137792047.0,Thurop Van Orman,"Rovio Animation, Columbia Pictures, Sony Pictures Animation, Rovio Entertainment",454640,The Angry Birds Movie 2
58,Angel Has Fallen,146661977.0,69030436.0,47.1,77631541.0,52.9,2019,"Action, Thriller",6.587/10,3493.0,en,United States of America,40000000.0,146661977.0,Ric Roman Waugh,"Campbell Grobman Films, Eclectic Pictures, G-BASE, Millennium Media",423204,Angel Has Fallen
59,Ad Astra,127461872.0,50188370.0,39.4,77273502.0,60.6,2019,"Science Fiction, Drama",6.11/10,6608.0,en,"Brazil, China, United States of America",87500000.0,127461872.0,James Gray,"New Regency Productions, MadRiver Pictures, Plan B Entertainment, RT Features, Bona Film Group, TSG Entertainment, Keep Your Head Productions, 20th Century Fox",419704,Ad Astra
60,Midway,127390389.0,56846802.0,44.6,70543587.0,55.4,2019,"Action, War, History",7.139/10,2478.0,en,"Canada, Hong Kong, United States of America",100000000.0,127400000.0,Roland Emmerich,"AGC Studios, Centropolis Entertainment, Street Entertainment, Entertainment One, Starlight Culture Entertainment Group, Shanghai RuYi Entertainment",522162,Midway
61,The Upside,125852517.0,108252517.0,86.0,17600000.0,14.0,2019,"Comedy, Drama",7.152/10,1275.0,en,United States of America,37500000.0,125000000.0,Neil Burger,Escape Artists,440472,The Upside
62,Last Christmas,123446172.0,35150750.0,28.5,88295422.0,71.5,2019,"Comedy, Romance",7.232/10,2401.0,en,"United Kingdom, United States of America",30000000.0,121600000.0,Paul Feig,"Universal Pictures, Feigco Entertainment",549053,Last Christmas
63,The Curse of La Llorona,123233739.0,54733739.0,44.4,68500000.0,55.6,2019,Horror,5.7/10,2434.0,en,United States of America,9000000.0,123233739.0,Michael Chaves,"Atomic Monster, New Line Cinema, Emile Gladstone Productions",480414,The Curse of La Llorona
64,Looking Up,122994583.0,84267.0,0.0,122910316.0,99.9,2019,"Family, Drama",5.4/10,17.0,zh,China,0.0,0.0,"Yu Baimei, Deng Chao",,603765,Looking Up
65,Zombieland: Double Tap,122810399.0,73123082.0,59.5,49687317.0,40.5,2019,"Comedy, Horror",6.9/10,5709.0,en,United States of America,42000000.0,122800000.0,Ruben Fleischer,"Pariah, Columbia Pictures, 2.0 Entertainment",338967,Zombieland: Double Tap
66,Dora and the Lost City of Gold,120597108.0,60477943.0,50.1,60119165.0,49.9,2019,"Adventure, Comedy, Family, Fantasy",6.6/10,1713.0,en,"Australia, United States of America",49000000.0,120600000.0,James Bobin,"Nickelodeon Movies, Paramount Players, Walden Media, Screen Queensland, Paramount Pictures, MRC",499701,Dora and the Lost City of Gold
67,Extreme Job,119932733.0,1565885.0,1.3,118366848.0,98.7,2019,"Action, Comedy, Crime",7.097/10,283.0,ko,South Korea,8120000.0,124652206.0,Lee Byeong-heon,"CJ Entertainment, about Film, Haegrimm Pictures",567646,Extreme Job
68,Wonder Park,119559110.0,45216793.0,37.8,74342317.0,62.2,2019,"Comedy, Animation, Adventure, Family, Fantasy",6.5/10,694.0,en,"Spain, United States of America",100000000.0,119559110.0,Dylan Brown,"Nickelodeon Movies, Paramount Animation, Ilion Animation Studios, Paramount Pictures",400157,Wonder Park
69,P Storm,117991727.0,326711.0,0.3,117665016.0,99.7,2019,"Action, Crime",6.4/10,61.0,cn,Hong Kong,0.0,0.0,David Lam Tak-Luk,Mandarin Motion Pictures,588073,P Storm
70,Detective Conan: The Fist of Blue Sapphire,115448200.0,0.0,0.0,115448200.0,100.0,2019,"Animation, Mystery, Crime, Action, Adventure",6.2/10,156.0,ja,Japan,0.0,115448200.0,Chika Nagaoka,"TMS Entertainment, Shogakukan, Yomiuri Telecasting Corporation, Nippon Television Network Corporation, Shogakukan-Shueisha Productions, TOHO",566555,Case Closed: The Fist of Blue Sapphire
71,The Gentlemen,115171795.0,36471795.0,31.7,78700000.0,68.3,2019,"Action, Crime, Comedy",7.7/10,5857.0,en,"United Kingdom, United States of America",22000000.0,115171795.0,Guy Ritchie,"Miramax, Toff Guy Films, Coach Films, STXfilms",522627,The Gentlemen
72,Pet Sematary,113118226.0,54724696.0,48.4,58393530.0,51.6,2019,"Horror, Thriller",5.738/10,3206.0,en,United States of America,21000000.0,113118226.0,"Dennis Widmyer, Kevin Kölsch","di Bonaventura Pictures, Paramount Pictures",157433,Pet Sematary
73,Boonie Bears: Blast Into the Past,112367881.0,0.0,0.0,112367881.0,100.0,2019,"Animation, Family, Adventure, Fantasy",7.0/10,23.0,zh,China,0.0,112369259.0,"Ding Liang, Huida Lin",Fantawild Animation,581218,Boonie Bears: Blast into the Past
74,Good Boys,111173598.0,83140306.0,74.8,28033292.0,25.2,2019,Comedy,6.8/10,1835.0,en,United States of America,20000000.0,111037232.0,Gene Stupnitsky,"Good Universe, Point Grey Pictures",521777,Good Boys
75,Scary Stories to Tell in the Dark,104545505.0,68947075.0,65.9,35598430.0,34.1,2019,"Horror, Thriller",6.5/10,2642.0,en,"Canada, Hong Kong, United States of America",25000000.0,104545505.0,André Øvredal,"1212 Entertainment, Double Dare You, Entertainment One, CBS Films, Rolling Hills, Hivemind, Starlight Culture Entertainment Group",417384,Scary Stories to Tell in the Dark
76,Line Walker 2: Invisible Spy,99482027.0,296751.0,0.3,99185276.0,99.7,2019,"Action, Crime, Thriller, Drama",6.9/10,52.0,cn,"China, Hong Kong",0.0,0.0,Jazz Boon,"Babieka Films, Shaw Brothers, One Cool Pictures, J.Q. Pictures, TVB, Big Honor Entertainment, Pegasus Motion Pictures, Alibaba Pictures Group, Tencent Pictures",589157,Line Walker 2: Invisible Spy
77,The Hustle,97409779.0,35417038.0,36.4,61992741.0,63.6,2019,"Comedy, Crime",6.181/10,2490.0,en,"Spain, United States of America",21000000.0,97400000.0,Chris Addison,"Pin High, Metro-Goldwyn-Mayer, Cave 76 Productions, Camp Sugar, Palma Pictures",449562,The Hustle
78,The New King of Comedy,95618308.0,0.0,0.0,95618308.0,100.0,2019,Comedy,5.8/10,31.0,zh,China,8000000.0,106618508.0,Stephen Chow,Star Overseas,575138,The New King of Comedy
79,Adoring,94975692.0,0.0,0.0,94975692.0,100.0,2019,"Drama, Family",7.0/10,8.0,zh,China,0.0,0.0,Larry Yang,"海润影视制作有限公司, Joy Leader",626616,Adoring
